title,description,published date,url,publisher
Omicron: Bronchitis may persist 'for weeks' post-infection - three clues in your cough - Express,Omicron: Bronchitis may persist 'for weeks' post-infection - three clues in your cough  Express,"Tue, 08 Nov 2022 08:00:00 GMT",https://news.google.com/rss/articles/CBMiaGh0dHBzOi8vd3d3LmV4cHJlc3MuY28udWsvbGlmZS1zdHlsZS9oZWFsdGgvMTY5MzEyMi9jb3JvbmF2aXJ1cy1sYXRlc3QtYnJvbmNoaXRpcy1zeW1wdG9tcy1jb3VnaC1vbWljcm9u0gFsaHR0cHM6Ly93d3cuZXhwcmVzcy5jby51ay9saWZlLXN0eWxlL2hlYWx0aC8xNjkzMTIyL2Nvcm9uYXZpcnVzLWxhdGVzdC1icm9uY2hpdGlzLXN5bXB0b21zLWNvdWdoLW9taWNyb24vYW1w?oc=5&hl=en-US&gl=US&ceid=US:en,"{'href': 'https://www.express.co.uk', 'title': 'Express'}"
Alyssa Milano talks ‘long-haul symptoms’ in new COVID-19 vaccine push - The Hill,Alyssa Milano talks ‘long-haul symptoms’ in new COVID-19 vaccine push  The Hill,"Tue, 25 May 2021 07:00:00 GMT",https://news.google.com/rss/articles/CBMieGh0dHBzOi8vdGhlaGlsbC5jb20vYmxvZ3MvaW4tdGhlLWtub3cvaW4tdGhlLWtub3cvNTU1MzkzLWFseXNzYS1taWxhbm8tdGFsa3MtbG9uZy1oYXVsLXN5bXB0b21zLWluLW5ldy1jb3ZpZC0xOS12YWNjaW5lL9IBfGh0dHBzOi8vdGhlaGlsbC5jb20vYmxvZ3MvaW4tdGhlLWtub3cvaW4tdGhlLWtub3cvNTU1MzkzLWFseXNzYS1taWxhbm8tdGFsa3MtbG9uZy1oYXVsLXN5bXB0b21zLWluLW5ldy1jb3ZpZC0xOS12YWNjaW5lL2FtcC8?oc=5&hl=en-US&gl=US&ceid=US:en,"{'href': 'https://thehill.com', 'title': 'The Hill'}"
Options for COVID symptoms and testing besides the emergency room - WATN - Local 24,Options for COVID symptoms and testing besides the emergency room  WATN - Local 24,"Wed, 05 Jan 2022 08:00:00 GMT",https://news.google.com/rss/articles/CBMipQFodHRwczovL3d3dy5sb2NhbG1lbXBoaXMuY29tL2FydGljbGUvbmV3cy9oZWFsdGgvY2FudC1nZXQtYW4tYXBwb2ludG1lbnQtd2l0aC15b3VyLXByaW1hcnktY2FyZS1waHlzaWNpYW4teW91LWhhdmUtYW4tb3B0aW9uLzUyMi0zNjJiMDUyMS05NGE0LTQzYzQtYmNkOS1hN2YzZDA2NGMyNDXSAQA?oc=5&hl=en-US&gl=US&ceid=US:en,"{'href': 'https://www.localmemphis.com', 'title': 'WATN - Local 24'}"
Pentagon Asks Personnel to Report Any Symptoms of Mysterious Ailments (Published 2021) - The New York Times,Pentagon Asks Personnel to Report Any Symptoms of Mysterious Ailments (Published 2021)  The New York Times,"Tue, 12 Oct 2021 07:00:00 GMT",https://news.google.com/rss/articles/CBMiTGh0dHBzOi8vd3d3Lm55dGltZXMuY29tLzIwMjEvMDkvMTUvdXMvcG9saXRpY3MvaGF2YW5hLXN5bmRyb21lLXBlbnRhZ29uLmh0bWzSAQA?oc=5&hl=en-US&gl=US&ceid=US:en,"{'href': 'https://www.nytimes.com', 'title': 'The New York Times'}"
Summer Flu: Symptoms and Possible Explanations - Healthline,Summer Flu: Symptoms and Possible Explanations  Healthline,"Tue, 05 Sep 2023 07:00:00 GMT",https://news.google.com/rss/articles/CBMiLGh0dHBzOi8vd3d3LmhlYWx0aGxpbmUuY29tL2hlYWx0aC9zdW1tZXItZmx10gEA?oc=5&hl=en-US&gl=US&ceid=US:en,"{'href': 'https://www.healthline.com', 'title': 'Healthline'}"
Solihull: Former leukaemia patient warns of 'vague' symptoms - BBC,Solihull: Former leukaemia patient warns of 'vague' symptoms  BBC,"Wed, 24 Aug 2022 07:00:00 GMT",https://news.google.com/rss/articles/CBMiOWh0dHBzOi8vd3d3LmJiYy5jby51ay9uZXdzL3VrLWVuZ2xhbmQtYmlybWluZ2hhbS02MjY0Njk4ONIBPWh0dHBzOi8vd3d3LmJiYy5jby51ay9uZXdzL3VrLWVuZ2xhbmQtYmlybWluZ2hhbS02MjY0Njk4OC5hbXA?oc=5&hl=en-US&gl=US&ceid=US:en,"{'href': 'https://www.bbc.co.uk', 'title': 'BBC'}"
Deborah James: What are the symptoms of bowel cancer and how can it be treated? - The Independent,Deborah James: What are the symptoms of bowel cancer and how can it be treated?  The Independent,"Mon, 17 Apr 2023 07:00:00 GMT",https://news.google.com/rss/articles/CBMidGh0dHBzOi8vd3d3LmluZGVwZW5kZW50LmNvLnVrL2xpZmUtc3R5bGUvaGVhbHRoLWFuZC1mYW1pbGllcy9kZWJvcmFoLWphbWVzLWZpcnN0LXN5bXB0b21zLWJvd2VsLWNhbmNlci1iMjMyMTA4Ny5odG1s0gEA?oc=5&hl=en-US&gl=US&ceid=US:en,"{'href': 'https://www.independent.co.uk', 'title': 'The Independent'}"
"I'm Over COVID Symptoms, but Still Testing Positive. Am I Infectious? - Medpage Today","I'm Over COVID Symptoms, but Still Testing Positive. Am I Infectious?  Medpage Today","Thu, 20 Jan 2022 08:00:00 GMT",https://news.google.com/rss/articles/CBMiPWh0dHBzOi8vd3d3Lm1lZHBhZ2V0b2RheS5jb20vc3BlY2lhbC1yZXBvcnRzL2V4Y2x1c2l2ZXMvOTY3NjXSAQA?oc=5&hl=en-US&gl=US&ceid=US:en,"{'href': 'https://www.medpagetoday.com', 'title': 'Medpage Today'}"
Covid symptoms update: Seven uncommon signs warning of an infection you need to know - Express,Covid symptoms update: Seven uncommon signs warning of an infection you need to know  Express,"Mon, 12 Apr 2021 07:00:00 GMT",https://news.google.com/rss/articles/CBMiYWh0dHBzOi8vd3d3LmV4cHJlc3MuY28udWsvbGlmZS1zdHlsZS9oZWFsdGgvMTQyMTg4MC9jb3ZpZC1zeW1wdG9tcy11cGRhdGUtc3ltcHRvbXMtc2lnbnMtY292aWQtMTnSAWVodHRwczovL3d3dy5leHByZXNzLmNvLnVrL2xpZmUtc3R5bGUvaGVhbHRoLzE0MjE4ODAvY292aWQtc3ltcHRvbXMtdXBkYXRlLXN5bXB0b21zLXNpZ25zLWNvdmlkLTE5L2FtcA?oc=5&hl=en-US&gl=US&ceid=US:en,"{'href': 'https://www.express.co.uk', 'title': 'Express'}"
Not-So-Silent Early-Stage Ovarian Cancer - Medpage Today,Not-So-Silent Early-Stage Ovarian Cancer  Medpage Today,"Thu, 06 Jan 2022 08:00:00 GMT",https://news.google.com/rss/articles/CBMiQ2h0dHBzOi8vd3d3Lm1lZHBhZ2V0b2RheS5jb20vaGVtYXRvbG9neW9uY29sb2d5L292YXJpYW5jYW5jZXIvOTY1NDjSAQA?oc=5&hl=en-US&gl=US&ceid=US:en,"{'href': 'https://www.medpagetoday.com', 'title': 'Medpage Today'}"
"COVID-19 symptoms may include altered senses of smell, taste - ABC News","COVID-19 symptoms may include altered senses of smell, taste  ABC News","Tue, 24 Mar 2020 07:00:00 GMT",https://news.google.com/rss/articles/CBMiZGh0dHBzOi8vYWJjbmV3cy5nby5jb20vSGVhbHRoL2NvdmlkLTE5LXN5bXB0b21zLWluY2x1ZGUtYWx0ZXJlZC1zZW5zZXMtc21lbGwtdGFzdGUvc3Rvcnk_aWQ9Njk3Njk2MjnSAWhodHRwczovL2FiY25ld3MuZ28uY29tL2FtcC9IZWFsdGgvY292aWQtMTktc3ltcHRvbXMtaW5jbHVkZS1hbHRlcmVkLXNlbnNlcy1zbWVsbC10YXN0ZS9zdG9yeT9pZD02OTc2OTYyOQ?oc=5&hl=en-US&gl=US&ceid=US:en,"{'href': 'https://abcnews.go.com', 'title': 'ABC News'}"
Vitamin B12 deficiency symptoms: The smelly symptom that may signal you're deficient - Express,Vitamin B12 deficiency symptoms: The smelly symptom that may signal you're deficient  Express,"Fri, 21 Aug 2020 07:00:00 GMT",https://news.google.com/rss/articles/CBMieWh0dHBzOi8vd3d3LmV4cHJlc3MuY28udWsvbGlmZS1zdHlsZS9oZWFsdGgvMTMyNTQzMy92aXRhbWluLWIxMi1kZWZpY2llbmN5LXN5bXB0b21zLWxvc3Mtb2Ytc21lbGwtZm9vZHMtaW5qZWN0aW9uLXRhYmxldHPSAX1odHRwczovL3d3dy5leHByZXNzLmNvLnVrL2xpZmUtc3R5bGUvaGVhbHRoLzEzMjU0MzMvdml0YW1pbi1iMTItZGVmaWNpZW5jeS1zeW1wdG9tcy1sb3NzLW9mLXNtZWxsLWZvb2RzLWluamVjdGlvbi10YWJsZXRzL2FtcA?oc=5&hl=en-US&gl=US&ceid=US:en,"{'href': 'https://www.express.co.uk', 'title': 'Express'}"
Boris Johnson's sister Rachel convinced she had Covid with bizarre toe symptom - The Mirror,Boris Johnson's sister Rachel convinced she had Covid with bizarre toe symptom  The Mirror,"Thu, 30 Jul 2020 07:00:00 GMT",https://news.google.com/rss/articles/CBMiWWh0dHBzOi8vd3d3Lm1pcnJvci5jby51ay8zYW0vY2VsZWJyaXR5LW5ld3MvcHJpbWUtbWluaXN0ZXItYm9yaXMtam9obnNvbnMtc2lzdGVyLTIyNDQwODU40gFdaHR0cHM6Ly93d3cubWlycm9yLmNvLnVrLzNhbS9jZWxlYnJpdHktbmV3cy9wcmltZS1taW5pc3Rlci1ib3Jpcy1qb2huc29ucy1zaXN0ZXItMjI0NDA4NTguYW1w?oc=5&hl=en-US&gl=US&ceid=US:en,"{'href': 'https://www.mirror.co.uk', 'title': 'The Mirror'}"
The key COVID-19 symptoms to watch out for - and when to call an ambulance - 9News,The key COVID-19 symptoms to watch out for - and when to call an ambulance  9News,"Wed, 25 Aug 2021 07:00:00 GMT",https://news.google.com/rss/articles/CBMilgFodHRwczovL3d3dy45bmV3cy5jb20uYXUvbmF0aW9uYWwvY29yb25hdmlydXMtbnN3LXVwZGF0ZXMtaWYteW91LWhhdmUtdGhlc2Utc3ltcHRvbXMtb2YtY292aWQxOS1jYWxsLWFuLWFtYnVsYW5jZS9iMjdlYjBkOS1jZTMzLTQ4MTctODYxNy1jNjBiZDAyMTFiOTDSAUVodHRwczovL2FtcC45bmV3cy5jb20uYXUvYXJ0aWNsZS9iMjdlYjBkOS1jZTMzLTQ4MTctODYxNy1jNjBiZDAyMTFiOTA?oc=5&hl=en-US&gl=US&ceid=US:en,"{'href': 'https://www.9news.com.au', 'title': '9News'}"
COVID-19 rash in kids and adults - Mayo Clinic,COVID-19 rash in kids and adults  Mayo Clinic,"Tue, 02 Nov 2021 07:00:00 GMT",https://news.google.com/rss/articles/CBMiT2h0dHBzOi8vbmV3c25ldHdvcmsubWF5b2NsaW5pYy5vcmcvZGlzY3Vzc2lvbi9jb3ZpZC0xOS1yYXNoLWluLWtpZHMtYW5kLWFkdWx0cy_SAQA?oc=5&hl=en-US&gl=US&ceid=US:en,"{'href': 'https://newsnetwork.mayoclinic.org', 'title': 'Mayo Clinic'}"
Can Paxlovid Treat the Symptoms of Long COVID? - TIME,Can Paxlovid Treat the Symptoms of Long COVID?  TIME,"Tue, 29 Nov 2022 08:00:00 GMT",https://news.google.com/rss/articles/CBMiN2h0dHBzOi8vdGltZS5jb20vNjIzNzIwMS9jYW4tcGF4bG92aWQtdHJlYXQtbG9uZy1jb3ZpZC_SAQA?oc=5&hl=en-US&gl=US&ceid=US:en,"{'href': 'https://time.com', 'title': 'TIME'}"
How keeping a diary of your symptoms might save your life - Daily Mail,How keeping a diary of your symptoms might save your life  Daily Mail,"Tue, 09 Nov 2021 08:00:00 GMT",https://news.google.com/rss/articles/CBMiXWh0dHBzOi8vd3d3LmRhaWx5bWFpbC5jby51ay9oZWFsdGgvYXJ0aWNsZS0xMDE3OTIxMy9Ib3cta2VlcGluZy1kaWFyeS1zeW1wdG9tcy1zYXZlLWxpZmUuaHRtbNIBYWh0dHBzOi8vd3d3LmRhaWx5bWFpbC5jby51ay9oZWFsdGgvYXJ0aWNsZS0xMDE3OTIxMy9hbXAvSG93LWtlZXBpbmctZGlhcnktc3ltcHRvbXMtc2F2ZS1saWZlLmh0bWw?oc=5&hl=en-US&gl=US&ceid=US:en,"{'href': 'https://www.dailymail.co.uk', 'title': 'Daily Mail'}"
COVID: Omicron symptoms to watch out for in fully vaccinated people - The Times of India,COVID: Omicron symptoms to watch out for in fully vaccinated people  The Times of India,"Tue, 28 Dec 2021 08:00:00 GMT",https://news.google.com/rss/articles/CBMiugFodHRwczovL3RpbWVzb2ZpbmRpYS5pbmRpYXRpbWVzLmNvbS9saWZlLXN0eWxlL2hlYWx0aC1maXRuZXNzL3dlYi1zdG9yaWVzL2Nvcm9uYXZpcnVzLW9taWNyb24tdmFyaWFudC1vbWljcm9uLXN5bXB0b21zLXRvLXdhdGNoLW91dC1mb3ItaW4tZnVsbHktdmFjY2luYXRlZC1wZW9wbGUvcGhvdG9zdG9yeS84ODU0MjYzNi5jbXPSAboBaHR0cHM6Ly90aW1lc29maW5kaWEuaW5kaWF0aW1lcy5jb20vbGlmZS1zdHlsZS9oZWFsdGgtZml0bmVzcy93ZWItc3Rvcmllcy9jb3JvbmF2aXJ1cy1vbWljcm9uLXZhcmlhbnQtb21pY3Jvbi1zeW1wdG9tcy10by13YXRjaC1vdXQtZm9yLWluLWZ1bGx5LXZhY2NpbmF0ZWQtcGVvcGxlL3Bob3Rvc3RvcnkvODg1NDI2MzYuY21z?oc=5&hl=en-US&gl=US&ceid=US:en,"{'href': 'https://timesofindia.indiatimes.com', 'title': 'The Times of India'}"
Teen Mental Health Signs and Symptoms - Newport Academy,Teen Mental Health Signs and Symptoms  Newport Academy,"Sun, 24 Jul 2022 04:55:09 GMT",https://news.google.com/rss/articles/CBMiQWh0dHBzOi8vd3d3Lm5ld3BvcnRhY2FkZW15LmNvbS90ZWVuLW1lbnRhbC1oZWFsdGgvc2lnbnMtc3ltcHRvbXMv0gEA?oc=5&hl=en-US&gl=US&ceid=US:en,"{'href': 'https://www.newportacademy.com', 'title': 'Newport Academy'}"
Know the Difference between Hay Fever and COVID-19 Symptoms - Limerick Post,Know the Difference between Hay Fever and COVID-19 Symptoms  Limerick Post,"Sat, 25 Apr 2020 07:00:00 GMT",https://news.google.com/rss/articles/CBMiY2h0dHBzOi8vd3d3LmxpbWVyaWNrcG9zdC5pZS8yMDIwLzA0LzI1L2tub3ctdGhlLWRpZmZlcmVuY2UtYmV0d2Vlbi1oYXktZmV2ZXItYW5kLWNvdmlkLTE5LXN5bXB0b21zL9IBAA?oc=5&hl=en-US&gl=US&ceid=US:en,"{'href': 'https://www.limerickpost.ie', 'title': 'Limerick Post'}"
"Athletic Training ECHO teaches concussion prevention, signs of symptoms - Oklahoma State University","Athletic Training ECHO teaches concussion prevention, signs of symptoms  Oklahoma State University","Wed, 16 Aug 2023 07:00:00 GMT",https://news.google.com/rss/articles/CBMigQFodHRwczovL25ld3Mub2tzdGF0ZS5lZHUvYXJ0aWNsZXMvY29tbXVuaWNhdGlvbnMvMjAyMy9hdGhsZXRpY190cmFpbmluZ19lY2hvX3RlYWNoZXNfY29uY3Vzc2lvbl9wcmV2ZW50aW9uX3NpZ25zX29mX3N5bXB0b21zLmh0bWzSAQA?oc=5&hl=en-US&gl=US&ceid=US:en,"{'href': 'https://news.okstate.edu', 'title': 'Oklahoma State University'}"
Magnesium Deficiency (Hypomagnesemia): Signs and Symptoms - Health.com,Magnesium Deficiency (Hypomagnesemia): Signs and Symptoms  Health.com,"Tue, 05 Sep 2023 07:00:00 GMT",https://news.google.com/rss/articles/CBMiPGh0dHBzOi8vd3d3LmhlYWx0aC5jb20vbWFnbmVzaXVtLWRlZmljaWVuY3ktc3ltcHRvbXMtNzY0MjM5MdIBAA?oc=5&hl=en-US&gl=US&ceid=US:en,"{'href': 'https://www.health.com', 'title': 'Health.com'}"
Most COVID Transmission Is Still Asymptomatic - Medpage Today,Most COVID Transmission Is Still Asymptomatic  Medpage Today,"Tue, 10 May 2022 07:00:00 GMT",https://news.google.com/rss/articles/CBMiPWh0dHBzOi8vd3d3Lm1lZHBhZ2V0b2RheS5jb20vc3BlY2lhbC1yZXBvcnRzL2V4Y2x1c2l2ZXMvOTg2MzLSAQA?oc=5&hl=en-US&gl=US&ceid=US:en,"{'href': 'https://www.medpagetoday.com', 'title': 'Medpage Today'}"
Leukaemia in six-year-old started as tiny night-time symptom - 7NEWS,Leukaemia in six-year-old started as tiny night-time symptom  7NEWS,"Fri, 08 Jul 2022 07:00:00 GMT",https://news.google.com/rss/articles/CBMijQFodHRwczovLzduZXdzLmNvbS5hdS9saWZlc3R5bGUvaGVhbHRoLXdlbGxiZWluZy90aW55LW5pZ2h0LXRpbWUtc3ltcHRvbS10dXJucy1vdXQtdG8tYmUtc2lnbi1vZi1zaXgteWVhci1vbGRzLWRldmFzdGF0aW5nLWRpYWdub3Npcy1jLTc0NDk0NDbSAZEBaHR0cHM6Ly83bmV3cy5jb20uYXUvbGlmZXN0eWxlL2hlYWx0aC13ZWxsYmVpbmcvdGlueS1uaWdodC10aW1lLXN5bXB0b20tdHVybnMtb3V0LXRvLWJlLXNpZ24tb2Ytc2l4LXllYXItb2xkcy1kZXZhc3RhdGluZy1kaWFnbm9zaXMtYy03NDQ5NDQ2LmFtcA?oc=5&hl=en-US&gl=US&ceid=US:en,"{'href': 'https://7news.com.au', 'title': '7NEWS'}"
Overlapping Symptoms of COVID-19 and Giant Cell Arteritis: The Need for a Higher Degree of Suspicion for Diagnostic ... - Cureus,Overlapping Symptoms of COVID-19 and Giant Cell Arteritis: The Need for a Higher Degree of Suspicion for Diagnostic ...  Cureus,"Sat, 04 Jun 2022 07:00:00 GMT",https://news.google.com/rss/articles/CBMiqAFodHRwczovL3d3dy5jdXJldXMuY29tL2FydGljbGVzLzk3ODkzLW92ZXJsYXBwaW5nLXN5bXB0b21zLW9mLWNvdmlkLTE5LWFuZC1naWFudC1jZWxsLWFydGVyaXRpcy10aGUtbmVlZC1mb3ItYS1oaWdoZXItZGVncmVlLW9mLXN1c3BpY2lvbi1mb3ItZGlhZ25vc3RpYy1kaWZmZXJlbnRpYXRpb27SAQA?oc=5&hl=en-US&gl=US&ceid=US:en,"{'href': 'https://www.cureus.com', 'title': 'Cureus'}"
"Luis Rubiales, Spain's soccer president, a symptom of sport's misogyny - USA TODAY","Luis Rubiales, Spain's soccer president, a symptom of sport's misogyny  USA TODAY","Fri, 25 Aug 2023 07:00:00 GMT",https://news.google.com/rss/articles/CBMioAFodHRwczovL3d3dy51c2F0b2RheS5jb20vc3Rvcnkvc3BvcnRzL2NvbHVtbmlzdC9uYW5jeS1hcm1vdXIvMjAyMy8wOC8yNS9sdWlzLXJ1YmlhbGVzLXNwYWluLXNvY2Nlci1mZWRlcmF0aW9uLXByZXNpZGVudC1pcy1zeW1wdG9tLW9mLWZpZmEtbWlzb2d5bnkvNzA2NzU0MDAwMDcv0gEA?oc=5&hl=en-US&gl=US&ceid=US:en,"{'href': 'https://www.usatoday.com', 'title': 'USA TODAY'}"
"Locally advanced breast cancer: Symptoms, outlook, and more - Medical News Today","Locally advanced breast cancer: Symptoms, outlook, and more  Medical News Today","Fri, 10 Sep 2021 07:00:00 GMT",https://news.google.com/rss/articles/CBMiSGh0dHBzOi8vd3d3Lm1lZGljYWxuZXdzdG9kYXkuY29tL2FydGljbGVzL2xvY2FsbHktYWR2YW5jZWQtYnJlYXN0LWNhbmNlctIBAA?oc=5&hl=en-US&gl=US&ceid=US:en,"{'href': 'https://www.medicalnewstoday.com', 'title': 'Medical News Today'}"
Cardiac arrest: Symptoms 24 hours before may differ for men and women - Medical News Today,Cardiac arrest: Symptoms 24 hours before may differ for men and women  Medical News Today,"Thu, 31 Aug 2023 07:00:00 GMT",https://news.google.com/rss/articles/CBMiXWh0dHBzOi8vd3d3Lm1lZGljYWxuZXdzdG9kYXkuY29tL2FydGljbGVzL2NhcmRpYS1hcnJlc3Qtc3ltcHRvbXMtMjQtaG91cnMtYmVmb3JlLW1lbi12cy13b21lbtIBAA?oc=5&hl=en-US&gl=US&ceid=US:en,"{'href': 'https://www.medicalnewstoday.com', 'title': 'Medical News Today'}"
"Difference between COVID-19, cold, flu, and allergy symptoms in charts - Business Insider","Difference between COVID-19, cold, flu, and allergy symptoms in charts  Business Insider","Sat, 10 Jul 2021 07:00:00 GMT",https://news.google.com/rss/articles/CBMiZGh0dHBzOi8vd3d3LmJ1c2luZXNzaW5zaWRlci5jb20vZGlmZmVyZW5jZS1iZXR3ZWVuLWNvdmlkLTE5LWRlbHRhLXN5bXB0b21zLWNvbGQtZmx1LWFsbGVyZ2llcy0yMDIxLTfSAWhodHRwczovL3d3dy5idXNpbmVzc2luc2lkZXIuY29tL2RpZmZlcmVuY2UtYmV0d2Vlbi1jb3ZpZC0xOS1kZWx0YS1zeW1wdG9tcy1jb2xkLWZsdS1hbGxlcmdpZXMtMjAyMS03P2FtcA?oc=5&hl=en-US&gl=US&ceid=US:en,"{'href': 'https://www.businessinsider.com', 'title': 'Business Insider'}"
Can I take ibuprofen to treat coronavirus symptoms? Expert advice on painkillers and Covid-19 - The Telegraph,Can I take ibuprofen to treat coronavirus symptoms? Expert advice on painkillers and Covid-19  The Telegraph,"Sat, 16 May 2020 07:00:00 GMT",https://news.google.com/rss/articles/CBMiVGh0dHBzOi8vd3d3LnRlbGVncmFwaC5jby51ay9uZXdzLzAvaWJ1cHJvZmVuLWNvcm9uYXZpcnVzLXdoaWNoLXBhaW5raWxsZXJzLWNvdmlkLTE5L9IBAA?oc=5&hl=en-US&gl=US&ceid=US:en,"{'href': 'https://www.telegraph.co.uk', 'title': 'The Telegraph'}"
Depression symptoms: Is TikTok a good mental health source? - Deseret News,Depression symptoms: Is TikTok a good mental health source?  Deseret News,"Fri, 12 Aug 2022 07:00:00 GMT",https://news.google.com/rss/articles/CBMigQFodHRwczovL3d3dy5kZXNlcmV0LmNvbS8yMDIyLzgvMTIvMjMyODEyNjMvaGFzLXRoZS1kaWdpdGFsLWFnZS1tYWRlLXVzLWFsbC1oeXBvY2hvbmRyaWFjcy13aGVuLWl0LWNvbWVzLXRvLW1lbnRhbC1pbGxuZXNzLXRpa3Rvay_SAQA?oc=5&hl=en-US&gl=US&ceid=US:en,"{'href': 'https://www.deseret.com', 'title': 'Deseret News'}"
Spanish study describes ‘Covid tongue’ as coronavirus symptom - EL PAÍS USA,Spanish study describes ‘Covid tongue’ as coronavirus symptom  EL PAÍS USA,"Mon, 01 Feb 2021 08:00:00 GMT",https://news.google.com/rss/articles/CBMic2h0dHBzOi8vZW5nbGlzaC5lbHBhaXMuY29tL3NjaWVuY2VfdGVjaC8yMDIxLTAyLTAxL3NwYW5pc2gtc3R1ZHktZGVzY3JpYmVzLWNvdmlkLXRvbmd1ZS1hcy1jb3JvbmF2aXJ1cy1zeW1wdG9tLmh0bWzSAYIBaHR0cHM6Ly9lbmdsaXNoLmVscGFpcy5jb20vc2NpZW5jZV90ZWNoLzIwMjEtMDItMDEvc3BhbmlzaC1zdHVkeS1kZXNjcmliZXMtY292aWQtdG9uZ3VlLWFzLWNvcm9uYXZpcnVzLXN5bXB0b20uaHRtbD9vdXRwdXRUeXBlPWFtcA?oc=5&hl=en-US&gl=US&ceid=US:en,"{'href': 'https://english.elpais.com', 'title': 'EL PAÍS USA'}"
"64% Indians with TB symptoms didn’t seek healthcare, finds 1st national survey since 1955-58 - ThePrint","64% Indians with TB symptoms didn’t seek healthcare, finds 1st national survey since 1955-58  ThePrint","Thu, 24 Mar 2022 07:00:00 GMT",https://news.google.com/rss/articles/CBMifGh0dHBzOi8vdGhlcHJpbnQuaW4vaGVhbHRoLzY0LWluZGlhbnMtd2l0aC10Yi1zeW1wdG9tcy1kaWRudC1zZWVrLWhlYWx0aGNhcmUtZmluZHMtMXN0LW5hdGlvbmFsLXN1cnZleS1zaW5jZS0xOTU1LTU4Lzg4NjQ4MS_SAYABaHR0cHM6Ly90aGVwcmludC5pbi9oZWFsdGgvNjQtaW5kaWFucy13aXRoLXRiLXN5bXB0b21zLWRpZG50LXNlZWstaGVhbHRoY2FyZS1maW5kcy0xc3QtbmF0aW9uYWwtc3VydmV5LXNpbmNlLTE5NTUtNTgvODg2NDgxLz9hbXA?oc=5&hl=en-US&gl=US&ceid=US:en,"{'href': 'https://theprint.in', 'title': 'ThePrint'}"
My 'Ear Infection' Symptoms Were Actually Early Signs of M.S. | SELF - Self,My 'Ear Infection' Symptoms Were Actually Early Signs of M.S. | SELF  Self,"Tue, 02 Aug 2022 07:00:00 GMT",https://news.google.com/rss/articles/CBMiSGh0dHBzOi8vd3d3LnNlbGYuY29tL3N0b3J5L2Vhci1pbmZlY3Rpb24tbWlzZGlhZ25vc2VkLW11bHRpcGxlLXNjbGVyb3Npc9IBAA?oc=5&hl=en-US&gl=US&ceid=US:en,"{'href': 'https://www.self.com', 'title': 'Self'}"
Shionogi's new COVID pill appears to ease omicron symptoms - Nikkei Asia,Shionogi's new COVID pill appears to ease omicron symptoms  Nikkei Asia,"Tue, 21 Dec 2021 08:00:00 GMT",https://news.google.com/rss/articles/CBMiaGh0dHBzOi8vYXNpYS5uaWtrZWkuY29tL1Nwb3RsaWdodC9Db3JvbmF2aXJ1cy9TaGlvbm9naS1zLW5ldy1DT1ZJRC1waWxsLWFwcGVhcnMtdG8tZWFzZS1vbWljcm9uLXN5bXB0b21z0gEA?oc=5&hl=en-US&gl=US&ceid=US:en,"{'href': 'https://asia.nikkei.com', 'title': 'Nikkei Asia'}"
'Shortness of breath' added as official Covid-19 symptom - Manx Radio,'Shortness of breath' added as official Covid-19 symptom  Manx Radio,"Thu, 14 Jan 2021 08:00:00 GMT",https://news.google.com/rss/articles/CBMilwFodHRwczovL3d3dy5tYW54cmFkaW8uY29tL25ld3MvaXNsZS1vZi1tYW4tbmV3cy9zaG9ydG5lc3Mtb2YtYnJlYXRoLWFkZGVkLWFzLW9mZmljaWFsLWNvdmlkLTE5LXN5bXB0b20vP2ZiX2NvbW1lbnRfaWQ9MzgwNDIwNjg4MzAwNzI0OF8zODA0Mjc3OTc5NjY2ODA10gEA?oc=5&hl=en-US&gl=US&ceid=US:en,"{'href': 'https://www.manxradio.com', 'title': 'Manx Radio'}"
Panoply visualises the symptoms of derealisation in a hypnotically chaotic 3D animation - Creative Boom,Panoply visualises the symptoms of derealisation in a hypnotically chaotic 3D animation  Creative Boom,"Thu, 10 Nov 2022 08:00:00 GMT",https://news.google.com/rss/articles/CBMiNmh0dHBzOi8vd3d3LmNyZWF0aXZlYm9vbS5jb20vaW5zcGlyYXRpb24vZGVyZWxpc2F0aW9uL9IBAA?oc=5&hl=en-US&gl=US&ceid=US:en,"{'href': 'https://www.creativeboom.com', 'title': 'Creative Boom'}"
Pancreatic cancer symptoms: Two 'early warning signs' of the 'silent disease' - Times Now,Pancreatic cancer symptoms: Two 'early warning signs' of the 'silent disease'  Times Now,"Tue, 16 Nov 2021 08:00:00 GMT",https://news.google.com/rss/articles/CBMie2h0dHBzOi8vd3d3LnRpbWVzbm93bmV3cy5jb20vaGVhbHRoL2FydGljbGUvcGFuY3JlYXRpYy1jYW5jZXItc3ltcHRvbXMtdHdvLWVhcmx5LXdhcm5pbmctc2lnbnMtb2YtdGhlLXNpbGVudC1kaXNlYXNlLzgzMjUzOdIBf2h0dHBzOi8vd3d3LnRpbWVzbm93bmV3cy5jb20vYW1wL2hlYWx0aC9hcnRpY2xlL3BhbmNyZWF0aWMtY2FuY2VyLXN5bXB0b21zLXR3by1lYXJseS13YXJuaW5nLXNpZ25zLW9mLXRoZS1zaWxlbnQtZGlzZWFzZS84MzI1Mzk?oc=5&hl=en-US&gl=US&ceid=US:en,"{'href': 'https://www.timesnownews.com', 'title': 'Times Now'}"
"Dying Wish announce new album 'Symptoms of Survival,' share new song & video - Brooklyn Vegan","Dying Wish announce new album 'Symptoms of Survival,' share new song & video  Brooklyn Vegan","Wed, 26 Jul 2023 07:00:00 GMT",https://news.google.com/rss/articles/CBMiZmh0dHBzOi8vd3d3LmJyb29rbHludmVnYW4uY29tL2R5aW5nLXdpc2gtYW5ub3VuY2UtbmV3LWFsYnVtLXN5bXB0b21zLW9mLXN1cnZpdmFsLXNoYXJlLW5ldy1zb25nLXZpZGVvL9IBAA?oc=5&hl=en-US&gl=US&ceid=US:en,"{'href': 'https://www.brooklynvegan.com', 'title': 'Brooklyn Vegan'}"
New app for palliative care patients gets a boost with Health Canada funding - William Osler Health System,New app for palliative care patients gets a boost with Health Canada funding  William Osler Health System,"Wed, 21 Apr 2021 07:00:00 GMT",https://news.google.com/rss/articles/CBMid2h0dHBzOi8vd3d3LndpbGxpYW1vc2xlcmhzLmNhL2VuL25ld3MvbmV3LWFwcC1mb3ItcGFsbGlhdGl2ZS1jYXJlLXBhdGllbnRzLWdldHMtYS1ib29zdC13aXRoLWhlYWx0aC1jYW5hZGEtZnVuZGluZy5hc3B40gEA?oc=5&hl=en-US&gl=US&ceid=US:en,"{'href': 'https://www.williamoslerhs.ca', 'title': 'William Osler Health System'}"
What Are the Symptoms of Bulimia? - Verywell Mind,What Are the Symptoms of Bulimia?  Verywell Mind,"Mon, 29 Nov 2021 08:00:00 GMT",https://news.google.com/rss/articles/CBMiRWh0dHBzOi8vd3d3LnZlcnl3ZWxsbWluZC5jb20vd2hhdC1hcmUtdGhlLXN5bXB0b21zLW9mLWJ1bGltaWEtNTIxMDM5MtIBAA?oc=5&hl=en-US&gl=US&ceid=US:en,"{'href': 'https://www.verywellmind.com', 'title': 'Verywell Mind'}"
'Mild COVID' isn't always mild: Tips for recovering at home - ABC News,'Mild COVID' isn't always mild: Tips for recovering at home  ABC News,"Sat, 15 Jan 2022 08:00:00 GMT",https://news.google.com/rss/articles/CBMiVGh0dHBzOi8vYWJjbmV3cy5nby5jb20vSGVhbHRoL21pbGQtY292aWQtbWlsZC10aXBzLXJlY292ZXJpbmctaG9tZS9zdG9yeT9pZD04MjIwNDY0OdIBWGh0dHBzOi8vYWJjbmV3cy5nby5jb20vYW1wL0hlYWx0aC9taWxkLWNvdmlkLW1pbGQtdGlwcy1yZWNvdmVyaW5nLWhvbWUvc3Rvcnk_aWQ9ODIyMDQ2NDk?oc=5&hl=en-US&gl=US&ceid=US:en,"{'href': 'https://abcnews.go.com', 'title': 'ABC News'}"
Martha Kalifatidis reveals the one symptom she can't shake off after testing positive for Covid-19 - Daily Mail,Martha Kalifatidis reveals the one symptom she can't shake off after testing positive for Covid-19  Daily Mail,"Sat, 01 Jan 2022 08:00:00 GMT",https://news.google.com/rss/articles/CBMiggFodHRwczovL3d3dy5kYWlseW1haWwuY28udWsvdHZzaG93Yml6L2FydGljbGUtMTAzNjA1MTUvTWFydGhhLUthbGlmYXRpZGlzLXJldmVhbHMtb25lLXN5bXB0b20tc2hha2UtdGVzdGluZy1wb3NpdGl2ZS1Db3ZpZC0xOS5odG1s0gGGAWh0dHBzOi8vd3d3LmRhaWx5bWFpbC5jby51ay90dnNob3diaXovYXJ0aWNsZS0xMDM2MDUxNS9hbXAvTWFydGhhLUthbGlmYXRpZGlzLXJldmVhbHMtb25lLXN5bXB0b20tc2hha2UtdGVzdGluZy1wb3NpdGl2ZS1Db3ZpZC0xOS5odG1s?oc=5&hl=en-US&gl=US&ceid=US:en,"{'href': 'https://www.dailymail.co.uk', 'title': 'Daily Mail'}"
ZOE Covid-19 Symptom Study app awarded £2m government grant - Digital Health,ZOE Covid-19 Symptom Study app awarded £2m government grant  Digital Health,"Wed, 19 Aug 2020 07:00:00 GMT",https://news.google.com/rss/articles/CBMiVmh0dHBzOi8vd3d3LmRpZ2l0YWxoZWFsdGgubmV0LzIwMjAvMDgvem9lLWNvdmlkLTE5LXN5bXB0b20tc3R1ZHktYXBwLWdvdmVybm1lbnQtZ3JhbnQv0gEA?oc=5&hl=en-US&gl=US&ceid=US:en,"{'href': 'https://www.digitalhealth.net', 'title': 'Digital Health'}"
"New coronavirus symptoms include headaches, loss of taste and smell - Global News","New coronavirus symptoms include headaches, loss of taste and smell  Global News","Sat, 11 Apr 2020 07:00:00 GMT",https://news.google.com/rss/articles/CBMiPGh0dHBzOi8vZ2xvYmFsbmV3cy5jYS9uZXdzLzY3OTg5NjkvbmV3LWNvcm9uYXZpcnVzLXN5bXB0b21zL9IBQGh0dHBzOi8vZ2xvYmFsbmV3cy5jYS9uZXdzLzY3OTg5NjkvbmV3LWNvcm9uYXZpcnVzLXN5bXB0b21zL2FtcC8?oc=5&hl=en-US&gl=US&ceid=US:en,"{'href': 'https://globalnews.ca', 'title': 'Global News'}"
9 Silent Signs of Liver Cancer You Shouldn't Ignore | The Healthy - The Healthy,9 Silent Signs of Liver Cancer You Shouldn't Ignore | The Healthy  The Healthy,"Thu, 17 Mar 2022 07:00:00 GMT",https://news.google.com/rss/articles/CBMiNWh0dHBzOi8vd3d3LnRoZWhlYWx0aHkuY29tL2NhbmNlci9saXZlci1jYW5jZXItc2lnbnMv0gEA?oc=5&hl=en-US&gl=US&ceid=US:en,"{'href': 'https://www.thehealthy.com', 'title': 'The Healthy'}"
"Treated or untreated, COVID symptoms can ease and then return, study finds - Medical Xpress","Treated or untreated, COVID symptoms can ease and then return, study finds  Medical Xpress","Mon, 31 Oct 2022 07:00:00 GMT",https://news.google.com/rss/articles/CBMiSWh0dHBzOi8vbWVkaWNhbHhwcmVzcy5jb20vbmV3cy8yMDIyLTEwLXVudHJlYXRlZC1jb3ZpZC1zeW1wdG9tcy1lYXNlLmh0bWzSAUhodHRwczovL21lZGljYWx4cHJlc3MuY29tL25ld3MvMjAyMi0xMC11bnRyZWF0ZWQtY292aWQtc3ltcHRvbXMtZWFzZS5hbXA?oc=5&hl=en-US&gl=US&ceid=US:en,"{'href': 'https://medicalxpress.com', 'title': 'Medical Xpress'}"
H3N2 Virus Influenza: Severe illness warning signs and symptoms you shouldn't ignore - India TV News,H3N2 Virus Influenza: Severe illness warning signs and symptoms you shouldn't ignore  India TV News,"Wed, 15 Mar 2023 07:00:00 GMT",https://news.google.com/rss/articles/CBMihwFodHRwczovL3d3dy5pbmRpYXR2bmV3cy5jb20vaGVhbHRoL2gzbjItdmlydXMtaW5mbHVlbnphLXNldmVyZS1pbGxuZXNzLXdhcm5pbmctc2lnbnMtYW5kLXN5bXB0b21zLXlvdS1zaG91bGRudC1pZ25vcmUtMjAyMy0wMy0xNS04NTQ0MjnSAYsBaHR0cHM6Ly93d3cuaW5kaWF0dm5ld3MuY29tL2FtcC9oZWFsdGgvaDNuMi12aXJ1cy1pbmZsdWVuemEtc2V2ZXJlLWlsbG5lc3Mtd2FybmluZy1zaWducy1hbmQtc3ltcHRvbXMteW91LXNob3VsZG50LWlnbm9yZS0yMDIzLTAzLTE1LTg1NDQyOQ?oc=5&hl=en-US&gl=US&ceid=US:en,"{'href': 'https://www.indiatvnews.com', 'title': 'India TV News'}"
