title,description,published date,url,publisher
Up to 92% of patients with blood clots in their lungs report 'tachypnea' - classic symptom - Express,Up to 92% of patients with blood clots in their lungs report 'tachypnea' - classic symptom  Express,"Thu, 12 Jan 2023 08:00:00 GMT",https://news.google.com/rss/articles/CBMiUWh0dHBzOi8vd3d3LmV4cHJlc3MuY28udWsvbGlmZS1zdHlsZS9oZWFsdGgvMTcyMDM3NC9ibG9vZC1jbG90LXN5bXB0b21zLXRhY2h5cG5lYdIBVWh0dHBzOi8vd3d3LmV4cHJlc3MuY28udWsvbGlmZS1zdHlsZS9oZWFsdGgvMTcyMDM3NC9ibG9vZC1jbG90LXN5bXB0b21zLXRhY2h5cG5lYS9hbXA?oc=5&hl=en-US&gl=US&ceid=US:en,"{'href': 'https://www.express.co.uk', 'title': 'Express'}"
"New COVID variant arcturus arrives in Florida — with a new, odd symptom - South Florida Sun Sentinel","New COVID variant arcturus arrives in Florida — with a new, odd symptom  South Florida Sun Sentinel","Mon, 24 Apr 2023 07:00:00 GMT",https://news.google.com/rss/articles/CBMibWh0dHBzOi8vd3d3LnN1bi1zZW50aW5lbC5jb20vMjAyMy8wNC8yNC9uZXctY292aWQtdmFyaWFudC1hcmN0dXJ1cy1hcnJpdmVzLWluLWZsb3JpZGEtd2l0aC1hLW5ldy1vZGQtc3ltcHRvbS_SAQA?oc=5&hl=en-US&gl=US&ceid=US:en,"{'href': 'https://www.sun-sentinel.com', 'title': 'South Florida Sun Sentinel'}"
"Gene Editing Therapy in Early Stages of Huntington's Disease May Slow Down Symptom Progression, Mouse Study ... - Johns Hopkins Medicine","Gene Editing Therapy in Early Stages of Huntington's Disease May Slow Down Symptom Progression, Mouse Study ...  Johns Hopkins Medicine","Wed, 07 Jul 2021 07:00:00 GMT",https://news.google.com/rss/articles/CBMiswFodHRwczovL3d3dy5ob3BraW5zbWVkaWNpbmUub3JnL25ld3MvbmV3c3Jvb20vbmV3cy1yZWxlYXNlcy8yMDIxLzA3L2dlbmUtZWRpdGluZy10aGVyYXB5LWluLWVhcmx5LXN0YWdlcy1vZi1odW50aW5ndG9ucy1kaXNlYXNlLW1heS1zbG93LWRvd24tc3ltcHRvbS1wcm9ncmVzc2lvbi1tb3VzZS1zdHVkeS1zaG93c9IBAA?oc=5&hl=en-US&gl=US&ceid=US:en,"{'href': 'https://www.hopkinsmedicine.org', 'title': 'Johns Hopkins Medicine'}"
Neuropsychiatric Symptoms in Rheumatic Disease Greatly Underestimated by Clinicians - MD Magazine,Neuropsychiatric Symptoms in Rheumatic Disease Greatly Underestimated by Clinicians  MD Magazine,"Thu, 27 Jul 2023 07:00:00 GMT",https://news.google.com/rss/articles/CBMicGh0dHBzOi8vd3d3LmhjcGxpdmUuY29tL3ZpZXcvbmV1cm9wc3ljaGlhdHJpYy1zeW1wdG9tcy1pbi1yaGV1bWF0aWMtZGlzZWFzZS1ncmVhdGx5LXVuZGVyZXN0aW1hdGVkLWJ5LWNsaW5pY2lhbnPSAQA?oc=5&hl=en-US&gl=US&ceid=US:en,"{'href': 'https://www.hcplive.com', 'title': 'MD Magazine'}"
Flu Cases With Covid-like Symptoms On Rise In India: All You Need To Know - Outlook India,Flu Cases With Covid-like Symptoms On Rise In India: All You Need To Know  Outlook India,"Sat, 04 Mar 2023 08:00:00 GMT",https://news.google.com/rss/articles/CBMiemh0dHBzOi8vd3d3Lm91dGxvb2tpbmRpYS5jb20vbmF0aW9uYWwvZmx1LWNhc2VzLXdpdGgtY292aWQtbGlrZS1zeW1wdG9tcy1vbi1yaXNlLWluLWluZGlhLWFsbC15b3UtbmVlZC10by1rbm93LW5ld3MtMjY3MjYw0gGEAWh0dHBzOi8vd3d3Lm91dGxvb2tpbmRpYS5jb20vYW1wL3N0b3J5L25hdGlvbmFsL2ZsdS1jYXNlcy13aXRoLWNvdmlkLWxpa2Utc3ltcHRvbXMtb24tcmlzZS1pbi1pbmRpYS1hbGwteW91LW5lZWQtdG8ta25vdy1uZXdzLTI2NzI2MA?oc=5&hl=en-US&gl=US&ceid=US:en,"{'href': 'https://www.outlookindia.com', 'title': 'Outlook India'}"
Can coronavirus cause diarrhea? - Medical News Today,Can coronavirus cause diarrhea?  Medical News Today,"Tue, 27 Oct 2020 07:00:00 GMT",https://news.google.com/rss/articles/CBMiQmh0dHBzOi8vd3d3Lm1lZGljYWxuZXdzdG9kYXkuY29tL2FydGljbGVzL2Nvcm9uYXZpcnVzLWFuZC1kaWFycmhlYdIBAA?oc=5&hl=en-US&gl=US&ceid=US:en,"{'href': 'https://www.medicalnewstoday.com', 'title': 'Medical News Today'}"
Coronavirus symptom: Body pain in THIS area could be a sign of COVID's Omicron variant - The Times of India,Coronavirus symptom: Body pain in THIS area could be a sign of COVID's Omicron variant  The Times of India,"Mon, 18 Jul 2022 07:00:00 GMT",https://news.google.com/rss/articles/CBMitgFodHRwczovL3RpbWVzb2ZpbmRpYS5pbmRpYXRpbWVzLmNvbS9saWZlLXN0eWxlL2hlYWx0aC1maXRuZXNzL2hlYWx0aC1uZXdzL2Nvcm9uYXZpcnVzLXN5bXB0b20tYm9keS1wYWluLWluLXRoaXMtYXJlYS1jb3VsZC1iZS1hLXNpZ24tb2YtY292aWRzLW9taWNyb24tdmFyaWFudC9waG90b3N0b3J5LzkyOTU2NzQxLmNtc9IBvAFodHRwczovL3RpbWVzb2ZpbmRpYS5pbmRpYXRpbWVzLmNvbS9saWZlLXN0eWxlL2hlYWx0aC1maXRuZXNzL2hlYWx0aC1uZXdzL2Nvcm9uYXZpcnVzLXN5bXB0b20tYm9keS1wYWluLWluLXRoaXMtYXJlYS1jb3VsZC1iZS1hLXNpZ24tb2YtY292aWRzLW9taWNyb24tdmFyaWFudC9hbXBfZXRwaG90b3N0b3J5LzkyOTU2NzQxLmNtcw?oc=5&hl=en-US&gl=US&ceid=US:en,"{'href': 'https://timesofindia.indiatimes.com', 'title': 'The Times of India'}"
8 Common Symptoms Of Fall Allergies – Causes and Treatment - Prevention Magazine,8 Common Symptoms Of Fall Allergies – Causes and Treatment  Prevention Magazine,"Wed, 10 Aug 2022 07:00:00 GMT",https://news.google.com/rss/articles/CBMiT2h0dHBzOi8vd3d3LnByZXZlbnRpb24uY29tL2hlYWx0aC9hMjA0NjcwNTEvZmFsbC1hbGxlcmd5LXN5bXB0b21zLWFuZC10cmlnZ2Vycy_SAQA?oc=5&hl=en-US&gl=US&ceid=US:en,"{'href': 'https://www.prevention.com', 'title': 'Prevention Magazine'}"
7 weird early pregnancy symptoms - The Times of India,7 weird early pregnancy symptoms  The Times of India,"Thu, 10 Dec 2020 08:00:00 GMT",https://news.google.com/rss/articles/CBMifWh0dHBzOi8vdGltZXNvZmluZGlhLmluZGlhdGltZXMuY29tL2xpZmUtc3R5bGUvcGFyZW50aW5nL3dlYi1zdG9yaWVzLzctd2VpcmQtZWFybHktcHJlZ25hbmN5LXN5bXB0b21zL3Bob3Rvc3RvcnkvNzk2NDU1NzMuY21z0gF9aHR0cHM6Ly90aW1lc29maW5kaWEuaW5kaWF0aW1lcy5jb20vbGlmZS1zdHlsZS9wYXJlbnRpbmcvd2ViLXN0b3JpZXMvNy13ZWlyZC1lYXJseS1wcmVnbmFuY3ktc3ltcHRvbXMvcGhvdG9zdG9yeS83OTY0NTU3My5jbXM?oc=5&hl=en-US&gl=US&ceid=US:en,"{'href': 'https://timesofindia.indiatimes.com', 'title': 'The Times of India'}"
"Keep a sharp eye out for COVID-19 symptoms now that Fourth gatherings have passed, experts say - The Boston Globe","Keep a sharp eye out for COVID-19 symptoms now that Fourth gatherings have passed, experts say  The Boston Globe","Tue, 05 Jul 2022 07:00:00 GMT",https://news.google.com/rss/articles/CBMiggFodHRwczovL3d3dy5ib3N0b25nbG9iZS5jb20vMjAyMi8wNy8wNS9uYXRpb24vZXhwZXJ0cy1rZWVwLXNoYXJwLWV5ZS1vdXQtY292aWQtMTktc3ltcHRvbXMtbm93LXRoYXQtZm91cnRoLWdhdGhlcmluZ3MtaGF2ZS1wYXNzZWQv0gEA?oc=5&hl=en-US&gl=US&ceid=US:en,"{'href': 'https://www.bostonglobe.com', 'title': 'The Boston Globe'}"
Dementia symptoms: Three 'changes' in your dietary preferences that can be 'early' signs - Express,Dementia symptoms: Three 'changes' in your dietary preferences that can be 'early' signs  Express,"Tue, 04 Jan 2022 08:00:00 GMT",https://news.google.com/rss/articles/CBMif2h0dHBzOi8vd3d3LmV4cHJlc3MuY28udWsvbGlmZS1zdHlsZS9oZWFsdGgvMTU0NDg4MC9kZW1lbnRpYS1zeW1wdG9tcy1zaWducy1lYXRpbmctbG90cy1vZi1zd2VldC10aGluZ3MtZnJvbnRvdGVtcG9yYWwtZGVtZW50aWHSAYMBaHR0cHM6Ly93d3cuZXhwcmVzcy5jby51ay9saWZlLXN0eWxlL2hlYWx0aC8xNTQ0ODgwL2RlbWVudGlhLXN5bXB0b21zLXNpZ25zLWVhdGluZy1sb3RzLW9mLXN3ZWV0LXRoaW5ncy1mcm9udG90ZW1wb3JhbC1kZW1lbnRpYS9hbXA?oc=5&hl=en-US&gl=US&ceid=US:en,"{'href': 'https://www.express.co.uk', 'title': 'Express'}"
"Mpox (Monkeypox): Signs, Symptoms, and Complications - Verywell Health","Mpox (Monkeypox): Signs, Symptoms, and Complications  Verywell Health","Fri, 09 Sep 2022 07:00:00 GMT",https://news.google.com/rss/articles/CBMiOWh0dHBzOi8vd3d3LnZlcnl3ZWxsaGVhbHRoLmNvbS9tb25rZXlwb3gtc3ltcHRvbXMtNjU0MTYwNdIBAA?oc=5&hl=en-US&gl=US&ceid=US:en,"{'href': 'https://www.verywellhealth.com', 'title': 'Verywell Health'}"
"7 Caffeine Withdrawal Symptoms You Should Know, From Experts | mindbodygreen - mindbodygreen","7 Caffeine Withdrawal Symptoms You Should Know, From Experts | mindbodygreen  mindbodygreen","Thu, 21 May 2020 07:00:00 GMT",https://news.google.com/rss/articles/CBMiOmh0dHBzOi8vd3d3Lm1pbmRib2R5Z3JlZW4uY29tL2FydGljbGVzL2NhZmZlaW5lLXdpdGhkcmF3YWzSAQA?oc=5&hl=en-US&gl=US&ceid=US:en,"{'href': 'https://www.mindbodygreen.com', 'title': 'mindbodygreen'}"
Warning sign on your skin could be symptom of common lung condition - Buckinghamshire Live,Warning sign on your skin could be symptom of common lung condition  Buckinghamshire Live,"Wed, 09 Aug 2023 07:00:00 GMT",https://news.google.com/rss/articles/CBMiW2h0dHBzOi8vd3d3LmJ1Y2tpbmdoYW1zaGlyZWxpdmUuY29tL25ld3MvdWstd29ybGQtbmV3cy93YXJuaW5nLXNpZ24teW91ci1za2luLWNvdWxkLTg2NjU4MzjSAQA?oc=5&hl=en-US&gl=US&ceid=US:en,"{'href': 'https://www.buckinghamshirelive.com', 'title': 'Buckinghamshire Live'}"
"Covid: Seven symptoms should trigger virus test, study says - BBC.com","Covid: Seven symptoms should trigger virus test, study says  BBC.com","Wed, 17 Feb 2021 08:00:00 GMT",https://news.google.com/rss/articles/CBMiJmh0dHBzOi8vd3d3LmJiYy5jb20vbmV3cy9oZWxwLTU2MDk2MjY00gEqaHR0cHM6Ly93d3cuYmJjLmNvbS9uZXdzL2hlbHAtNTYwOTYyNjQuYW1w?oc=5&hl=en-US&gl=US&ceid=US:en,"{'href': 'https://www.bbc.com', 'title': 'BBC.com'}"
"Free-Floating Anxiety: Definition, Symptoms, Traits, Causes, Treatment - Verywell Mind","Free-Floating Anxiety: Definition, Symptoms, Traits, Causes, Treatment  Verywell Mind","Mon, 25 Jul 2022 07:00:00 GMT",https://news.google.com/rss/articles/CBMiZmh0dHBzOi8vd3d3LnZlcnl3ZWxsbWluZC5jb20vZnJlZS1mbG9hdGluZy1hbnhpZXR5LWRlZmluaXRpb24tc3ltcHRvbXMtdHJhaXRzLWNhdXNlcy10cmVhdG1lbnQtNTExNjYyM9IBAA?oc=5&hl=en-US&gl=US&ceid=US:en,"{'href': 'https://www.verywellmind.com', 'title': 'Verywell Mind'}"
5 RSV Symptoms in Babies Caregivers Should Never Ignore - Parents,5 RSV Symptoms in Babies Caregivers Should Never Ignore  Parents,"Thu, 29 Dec 2022 08:00:00 GMT",https://news.google.com/rss/articles/CBMiS2h0dHBzOi8vd3d3LnBhcmVudHMuY29tL2JhYnkvY2FyZS9yc3Ytc3ltcHRvbXMtaW4tbmV3Ym9ybnMtbmV2ZXItdG8taWdub3JlL9IBAA?oc=5&hl=en-US&gl=US&ceid=US:en,"{'href': 'https://www.parents.com', 'title': 'Parents'}"
Signs That You’re Suffering From Irritable Bowel Syndrome (IBS) | TheHealthSite.com - TheHealthSite,Signs That You’re Suffering From Irritable Bowel Syndrome (IBS) | TheHealthSite.com  TheHealthSite,"Tue, 25 Apr 2023 07:00:00 GMT",https://news.google.com/rss/articles/CBMiiQFodHRwczovL3d3dy50aGVoZWFsdGhzaXRlLmNvbS9kaXNlYXNlcy1jb25kaXRpb25zL2licy9pYnMtYXdhcmVuZXNzLW1vbnRoLXRpcHMtZm9yLXJlbGlldmluZy1zeW1wdG9tcy1vZi1pcnJpdGFibGUtYm93ZWwtc3luZHJvbWUtOTcxODU2L9IBjQFodHRwczovL3d3dy50aGVoZWFsdGhzaXRlLmNvbS9kaXNlYXNlcy1jb25kaXRpb25zL2licy9pYnMtYXdhcmVuZXNzLW1vbnRoLXRpcHMtZm9yLXJlbGlldmluZy1zeW1wdG9tcy1vZi1pcnJpdGFibGUtYm93ZWwtc3luZHJvbWUtOTcxODU2L2FtcC8?oc=5&hl=en-US&gl=US&ceid=US:en,"{'href': 'https://www.thehealthsite.com', 'title': 'TheHealthSite'}"
"Do presenting symptoms, use of pre-diagnostic endoscopy and risk of emergency cancer diagnosis vary by comorbidity ... - Nature.com","Do presenting symptoms, use of pre-diagnostic endoscopy and risk of emergency cancer diagnosis vary by comorbidity ...  Nature.com","Fri, 05 Nov 2021 07:00:00 GMT",https://news.google.com/rss/articles/CBMiMmh0dHBzOi8vd3d3Lm5hdHVyZS5jb20vYXJ0aWNsZXMvczQxNDE2LTAyMS0wMTYwMy030gEA?oc=5&hl=en-US&gl=US&ceid=US:en,"{'href': 'https://www.nature.com', 'title': 'Nature.com'}"
Experts say moving to Hawaii won't help seasonal depression symptoms - KITV Honolulu,Experts say moving to Hawaii won't help seasonal depression symptoms  KITV Honolulu,"Sat, 03 Dec 2022 08:00:00 GMT",https://news.google.com/rss/articles/CBMilQFodHRwczovL3d3dy5raXR2LmNvbS9uZXdzL2xvY2FsL2V4cGVydHMtc2F5LW1vdmluZy10by1oYXdhaWktd29udC1oZWxwLXNlYXNvbmFsLWRlcHJlc3Npb24tc3ltcHRvbXMvYXJ0aWNsZV9jYjNjZTQyMC03MzkwLTExZWQtODY2ZC1jNzM4ZjUwYzY0MTUuaHRtbNIBAA?oc=5&hl=en-US&gl=US&ceid=US:en,"{'href': 'https://www.kitv.com', 'title': 'KITV Honolulu'}"
Why strange and debilitating coronavirus symptoms can last for months - New Scientist,Why strange and debilitating coronavirus symptoms can last for months  New Scientist,"Wed, 24 Jun 2020 07:00:00 GMT",https://news.google.com/rss/articles/CBMiemh0dHBzOi8vd3d3Lm5ld3NjaWVudGlzdC5jb20vYXJ0aWNsZS9tZzI0NjMyODgxLTQwMC13aHktc3RyYW5nZS1hbmQtZGViaWxpdGF0aW5nLWNvcm9uYXZpcnVzLXN5bXB0b21zLWNhbi1sYXN0LWZvci1tb250aHMv0gEA?oc=5&hl=en-US&gl=US&ceid=US:en,"{'href': 'https://www.newscientist.com', 'title': 'New Scientist'}"
Some Celebs Occupied Beds Despite Mild Symptoms: Maharashtra Minister - NDTV,Some Celebs Occupied Beds Despite Mild Symptoms: Maharashtra Minister  NDTV,"Tue, 13 Apr 2021 07:00:00 GMT",https://news.google.com/rss/articles/CBMifmh0dHBzOi8vd3d3Lm5kdHYuY29tL2luZGlhLW5ld3MvbWFoYXJhc2h0cmEtbWluaXN0ZXItYXNsYW0tc2hhaWtoLXNheXMtc29tZS1jZWxlYnMtb2NjdXBpZWQtYmVkcy1kZXNwaXRlLW1pbGQtc3ltcHRvbXMtMjQxMjY5M9IBhAFodHRwczovL3d3dy5uZHR2LmNvbS9pbmRpYS1uZXdzL21haGFyYXNodHJhLW1pbmlzdGVyLWFzbGFtLXNoYWlraC1zYXlzLXNvbWUtY2VsZWJzLW9jY3VwaWVkLWJlZHMtZGVzcGl0ZS1taWxkLXN5bXB0b21zLTI0MTI2OTMvYW1wLzE?oc=5&hl=en-US&gl=US&ceid=US:en,"{'href': 'https://www.ndtv.com', 'title': 'NDTV'}"
Coronavirus symptoms: Why day 5 and day 10 are most important for COVID patients - The Times of India,Coronavirus symptoms: Why day 5 and day 10 are most important for COVID patients  The Times of India,"Wed, 11 Nov 2020 08:00:00 GMT",https://news.google.com/rss/articles/CBMisQFodHRwczovL3RpbWVzb2ZpbmRpYS5pbmRpYXRpbWVzLmNvbS9saWZlLXN0eWxlL2hlYWx0aC1maXRuZXNzL2hlYWx0aC1uZXdzL2Nvcm9uYXZpcnVzLXN5bXB0b21zLXdoeS1kYXktNS1hbmQtZGF5LTEwLWFyZS1tb3N0LWltcG9ydGFudC1mb3ItY292aWQtcGF0aWVudHMvcGhvdG9zdG9yeS83OTE3MDIzMC5jbXPSAbcBaHR0cHM6Ly90aW1lc29maW5kaWEuaW5kaWF0aW1lcy5jb20vbGlmZS1zdHlsZS9oZWFsdGgtZml0bmVzcy9oZWFsdGgtbmV3cy9jb3JvbmF2aXJ1cy1zeW1wdG9tcy13aHktZGF5LTUtYW5kLWRheS0xMC1hcmUtbW9zdC1pbXBvcnRhbnQtZm9yLWNvdmlkLXBhdGllbnRzL2FtcF9ldHBob3Rvc3RvcnkvNzkxNzAyMzAuY21z?oc=5&hl=en-US&gl=US&ceid=US:en,"{'href': 'https://timesofindia.indiatimes.com', 'title': 'The Times of India'}"
Real-time symptom tracking for long COVID - Open Access Government,Real-time symptom tracking for long COVID  Open Access Government,"Fri, 18 Jun 2021 07:00:00 GMT",https://news.google.com/rss/articles/CBMiQGh0dHBzOi8vd3d3Lm9wZW5hY2Nlc3Nnb3Zlcm5tZW50Lm9yZy90cmFja2luZy1sb25nLWNvdmlkLzExMzMxNS_SAQA?oc=5&hl=en-US&gl=US&ceid=US:en,"{'href': 'https://www.openaccessgovernment.org', 'title': 'Open Access Government'}"
Symptoms and Treatment of Excess Sun Exposure - Verywell Health,Symptoms and Treatment of Excess Sun Exposure  Verywell Health,"Fri, 07 Oct 2022 07:00:00 GMT",https://news.google.com/rss/articles/CBMiPGh0dHBzOi8vd3d3LnZlcnl3ZWxsaGVhbHRoLmNvbS90b28tbXVjaC1zdW4tZXhwb3N1cmUtMTI5ODc2NtIBAA?oc=5&hl=en-US&gl=US&ceid=US:en,"{'href': 'https://www.verywellhealth.com', 'title': 'Verywell Health'}"
Burning mouth syndrome: Why doctors sometimes fight its fire with fire - Mayo Clinic,Burning mouth syndrome: Why doctors sometimes fight its fire with fire  Mayo Clinic,"Mon, 10 Jul 2023 07:00:00 GMT",https://news.google.com/rss/articles/CBMidGh0dHBzOi8vbmV3c25ldHdvcmsubWF5b2NsaW5pYy5vcmcvZGlzY3Vzc2lvbi9idXJuaW5nLW1vdXRoLXN5bmRyb21lLXdoeS1kb2N0b3JzLXNvbWV0aW1lcy1maWdodC1pdHMtZmlyZS13aXRoLWZpcmUv0gEA?oc=5&hl=en-US&gl=US&ceid=US:en,"{'href': 'https://newsnetwork.mayoclinic.org', 'title': 'Mayo Clinic'}"
Feeling Sick After Thanksgiving? Here's What Experts Say You Should Do - NBC Chicago,Feeling Sick After Thanksgiving? Here's What Experts Say You Should Do  NBC Chicago,"Tue, 29 Nov 2022 08:00:00 GMT",https://news.google.com/rss/articles/CBMic2h0dHBzOi8vd3d3Lm5iY2NoaWNhZ28uY29tL25ld3MvbG9jYWwvZmVlbGluZy1zaWNrLWFmdGVyLXRoYW5rc2dpdmluZy1oZXJlcy13aGF0LWV4cGVydHMtc2F5LXlvdS1zaG91bGQtZG8vMzAwODc0Ni_SAXlodHRwczovL3d3dy5uYmNjaGljYWdvLmNvbS9uZXdzL2xvY2FsL2ZlZWxpbmctc2ljay1hZnRlci10aGFua3NnaXZpbmctaGVyZXMtd2hhdC1leHBlcnRzLXNheS15b3Utc2hvdWxkLWRvLzMwMDg3NDYvP2FtcD0x?oc=5&hl=en-US&gl=US&ceid=US:en,"{'href': 'https://www.nbcchicago.com', 'title': 'NBC Chicago'}"
Autism: a wide range of symptoms | CAMC Health System - Charleston Area Medical Center,Autism: a wide range of symptoms | CAMC Health System  Charleston Area Medical Center,"Fri, 12 May 2023 07:00:00 GMT",https://news.google.com/rss/articles/CBMiNGh0dHBzOi8vd3d3LmNhbWMub3JnL25ld3MvYXV0aXNtLXdpZGUtcmFuZ2Utc3ltcHRvbXPSAQA?oc=5&hl=en-US&gl=US&ceid=US:en,"{'href': 'https://www.camc.org', 'title': 'Charleston Area Medical Center'}"
My Mornings Are Broken Due to Parkinson's Disease | Are... - Parkinson's News Today,My Mornings Are Broken Due to Parkinson's Disease | Are...  Parkinson's News Today,"Fri, 12 Aug 2022 07:00:00 GMT",https://news.google.com/rss/articles/CBMiUWh0dHBzOi8vcGFya2luc29uc25ld3N0b2RheS5jb20vY29sdW1ucy9wYXJraW5zb25zLXN5bXB0b21zLXdvcnNlLW1vcm5pbmctYnJva2VuL9IBAA?oc=5&hl=en-US&gl=US&ceid=US:en,"{'href': 'https://parkinsonsnewstoday.com', 'title': ""Parkinson's News Today""}"
Post-COVID-19 clinic supports survivors with long-term symptoms - FOX13 Memphis,Post-COVID-19 clinic supports survivors with long-term symptoms  FOX13 Memphis,"Tue, 16 Mar 2021 07:00:00 GMT",https://news.google.com/rss/articles/CBMikwFodHRwczovL3d3dy5mb3gxM21lbXBoaXMuY29tL25ld3MvcG9zdC1jb3ZpZC0xOS1jbGluaWMtc3VwcG9ydHMtc3Vydml2b3JzLXdpdGgtbG9uZy10ZXJtLXN5bXB0b21zL2FydGljbGVfZTU2OGRmNGMtNWUyNy01ZjE2LWI3YWUtNjZhMDhmMTk1NmNlLmh0bWzSAQA?oc=5&hl=en-US&gl=US&ceid=US:en,"{'href': 'https://www.fox13memphis.com', 'title': 'FOX13 Memphis'}"
Billboard listening to cold symptoms – Remind Swedes of KLM's full refund offering – Marketing Communication News - MarComm News,Billboard listening to cold symptoms – Remind Swedes of KLM's full refund offering – Marketing Communication News  MarComm News,"Fri, 23 Apr 2021 07:00:00 GMT",https://news.google.com/rss/articles/CBMiaGh0dHBzOi8vbWFyY29tbW5ld3MuY29tL2JpbGxib2FyZC1saXN0ZW5pbmctdG8tY29sZC1zeW1wdG9tcy1yZW1pbmQtc3dlZGVzLW9mLWtsbXMtZnVsbC1yZWZ1bmQtb2ZmZXJpbmcv0gEA?oc=5&hl=en-US&gl=US&ceid=US:en,"{'href': 'https://marcommnews.com', 'title': 'MarComm News'}"
Symptoms of ovarian cancer: Sydney social worker Monika Tasic reveals signs every woman should know - Daily Mail,Symptoms of ovarian cancer: Sydney social worker Monika Tasic reveals signs every woman should know  Daily Mail,"Sun, 03 Jan 2021 08:00:00 GMT",https://news.google.com/rss/articles/CBMiigFodHRwczovL3d3dy5kYWlseW1haWwuY28udWsvZmVtYWlsL2FydGljbGUtOTA5ODAwNS9TeW1wdG9tcy1vdmFyaWFuLWNhbmNlci1TeWRuZXktc29jaWFsLXdvcmtlci1Nb25pa2EtVGFzaWMtcmV2ZWFscy1zaWducy13b21hbi1rbm93Lmh0bWzSAY4BaHR0cHM6Ly93d3cuZGFpbHltYWlsLmNvLnVrL2ZlbWFpbC9hcnRpY2xlLTkwOTgwMDUvYW1wL1N5bXB0b21zLW92YXJpYW4tY2FuY2VyLVN5ZG5leS1zb2NpYWwtd29ya2VyLU1vbmlrYS1UYXNpYy1yZXZlYWxzLXNpZ25zLXdvbWFuLWtub3cuaHRtbA?oc=5&hl=en-US&gl=US&ceid=US:en,"{'href': 'https://www.dailymail.co.uk', 'title': 'Daily Mail'}"
10 Sneaky Diabetes Symptoms You Should Watch Out For - AARP,10 Sneaky Diabetes Symptoms You Should Watch Out For  AARP,"Mon, 04 Apr 2022 07:00:00 GMT",https://news.google.com/rss/articles/CBMiWWh0dHBzOi8vd3d3LmFhcnAub3JnL2hlYWx0aC9jb25kaXRpb25zLXRyZWF0bWVudHMvaW5mby0yMDIyL3NuZWFreS1kaWFiZXRlcy1zeW1wdG9tcy5odG1s0gEA?oc=5&hl=en-US&gl=US&ceid=US:en,"{'href': 'https://www.aarp.org', 'title': 'AARP'}"
Feasibility and Acceptability of Remote Symptom Monitoring (RSM) in Older Adults During Treatment for Metastatic ... - UroToday,Feasibility and Acceptability of Remote Symptom Monitoring (RSM) in Older Adults During Treatment for Metastatic ...  UroToday,"Tue, 30 May 2023 07:00:00 GMT",https://news.google.com/rss/articles/CBMi5QFodHRwOi8vd3d3LnVyb3RvZGF5LmNvbS9yZWNlbnQtYWJzdHJhY3RzL3Vyb2xvZ2ljLW9uY29sb2d5L3Byb3N0YXRlLWNhbmNlci8xNDQzMzItZmVhc2liaWxpdHktYW5kLWFjY2VwdGFiaWxpdHktb2YtcmVtb3RlLXN5bXB0b20tbW9uaXRvcmluZy1pbi1vbGRlci1hZHVsdHMtZHVyaW5nLXRyZWF0bWVudC1mb3ItbWV0YXN0YXRpYy1wcm9zdGF0ZS1jYW5jZXItYmV5b25kLXRoZS1hYnN0cmFjdC5odG1s0gEA?oc=5&hl=en-US&gl=US&ceid=US:en,"{'href': 'http://www.urotoday.com', 'title': 'UroToday'}"
"Lyme disease can mimic symptoms of COVID-19, health officials warn - The Times","Lyme disease can mimic symptoms of COVID-19, health officials warn  The Times","Fri, 19 Jun 2020 07:00:00 GMT",https://news.google.com/rss/articles/CBMiiQFodHRwczovL3d3dy50aW1lc29ubGluZS5jb20vc3Rvcnkvc3BvcnRzL291dGRvb3JzLzIwMjAvMDYvMTkvbHltZS1kaXNlYXNlLWNhbi1taW1pYy1zeW1wdG9tcy1vZi1jb3ZpZC0xOS1oZWFsdGgtb2ZmaWNpYWxzLXdhcm4vMTEyODE2MzMyL9IBAA?oc=5&hl=en-US&gl=US&ceid=US:en,"{'href': 'https://www.timesonline.com', 'title': 'The Times'}"
"This Surprising Symptom May Reveal You're Sensitive to Milk - Eat This, Not That","This Surprising Symptom May Reveal You're Sensitive to Milk  Eat This, Not That","Tue, 15 Jun 2021 07:00:00 GMT",https://news.google.com/rss/articles/CBMiQmh0dHBzOi8vd3d3LmVhdHRoaXMuY29tL25ld3Mtc2Vuc2l0aXZlLXRvLW1pbGstc3VycHJpc2luZy1zeW1wdG9tL9IBAA?oc=5&hl=en-US&gl=US&ceid=US:en,"{'href': 'https://www.eatthis.com', 'title': 'Eat This, Not That'}"
"Traces, Signs, and Symptoms of the Untranslatable - Journal #108 - E-Flux","Traces, Signs, and Symptoms of the Untranslatable - Journal #108  E-Flux","Thu, 09 Apr 2020 17:08:15 GMT",https://news.google.com/rss/articles/CBMiWmh0dHBzOi8vd3d3LmUtZmx1eC5jb20vam91cm5hbC8xMDgvMzI1ODU5L3RyYWNlcy1zaWducy1hbmQtc3ltcHRvbXMtb2YtdGhlLXVudHJhbnNsYXRhYmxlL9IBAA?oc=5&hl=en-US&gl=US&ceid=US:en,"{'href': 'https://www.e-flux.com', 'title': 'E-Flux'}"
B12 deficiency: The 4 uncomfortable signs on your tongue you could be low on B12 - Express,B12 deficiency: The 4 uncomfortable signs on your tongue you could be low on B12  Express,"Tue, 09 Aug 2022 07:00:00 GMT",https://news.google.com/rss/articles/CBMia2h0dHBzOi8vd3d3LmV4cHJlc3MuY28udWsvbGlmZS1zdHlsZS9oZWFsdGgvMTY1MjY4MC9CMTItZGVmaWNpZW5jeS1zeW1wdG9tcy00LXNpZ25zLXRvbmd1ZS1mb29kcy1pbmplY3Rpb25z0gFvaHR0cHM6Ly93d3cuZXhwcmVzcy5jby51ay9saWZlLXN0eWxlL2hlYWx0aC8xNjUyNjgwL0IxMi1kZWZpY2llbmN5LXN5bXB0b21zLTQtc2lnbnMtdG9uZ3VlLWZvb2RzLWluamVjdGlvbnMvYW1w?oc=5&hl=en-US&gl=US&ceid=US:en,"{'href': 'https://www.express.co.uk', 'title': 'Express'}"
What are the symptoms of COVID-19? - Livescience.com,What are the symptoms of COVID-19?  Livescience.com,"Tue, 15 Mar 2022 07:00:00 GMT",https://news.google.com/rss/articles/CBMiNWh0dHBzOi8vd3d3LmxpdmVzY2llbmNlLmNvbS9jb3JvbmF2aXJ1cy1zeW1wdG9tcy5odG1s0gEA?oc=5&hl=en-US&gl=US&ceid=US:en,"{'href': 'https://www.livescience.com', 'title': 'Livescience.com'}"
"Long COVID patients struggle to get benefits: ""We're left behind"" - CBS News","Long COVID patients struggle to get benefits: ""We're left behind""  CBS News","Wed, 06 Jul 2022 07:00:00 GMT",https://news.google.com/rss/articles/CBMiT2h0dHBzOi8vd3d3LmNic25ld3MuY29tL25ld3MvbG9uZy1jb3ZpZC1zeW1wdG9tcy1kaXNhYmlsaXR5LWJlbmVmaXRzLWluc3VyYW5jZS_SAVNodHRwczovL3d3dy5jYnNuZXdzLmNvbS9hbXAvbmV3cy9sb25nLWNvdmlkLXN5bXB0b21zLWRpc2FiaWxpdHktYmVuZWZpdHMtaW5zdXJhbmNlLw?oc=5&hl=en-US&gl=US&ceid=US:en,"{'href': 'https://www.cbsnews.com', 'title': 'CBS News'}"
COVID-19 can affect the brain. New clues hint at how - Science News Magazine,COVID-19 can affect the brain. New clues hint at how  Science News Magazine,"Tue, 27 Apr 2021 07:00:00 GMT",https://news.google.com/rss/articles/CBMiXWh0dHBzOi8vd3d3LnNjaWVuY2VuZXdzLm9yZy9hcnRpY2xlL2NvdmlkLWJyYWluLWNvcm9uYXZpcnVzLXN5bXB0b20tc3Ryb2tlLWFueGlldHktZGVwcmVzc2lvbtIBAA?oc=5&hl=en-US&gl=US&ceid=US:en,"{'href': 'https://www.sciencenews.org', 'title': 'Science News Magazine'}"
Nipah virus outbreak in India: What are its symptoms and treatment - Reuters,Nipah virus outbreak in India: What are its symptoms and treatment  Reuters,"Thu, 14 Sep 2023 07:00:00 GMT",https://news.google.com/rss/articles/CBMigwFodHRwczovL3d3dy5yZXV0ZXJzLmNvbS9idXNpbmVzcy9oZWFsdGhjYXJlLXBoYXJtYWNldXRpY2Fscy93aGF0LWlzLW5pcGFoLXZpcnVzLXRoYXQta2lsbGVkLXR3by1pbmRpYS1ob3ctaXMtaXQtdHJlYXRlZC0yMDIzLTA5LTE0L9IBAA?oc=5&hl=en-US&gl=US&ceid=US:en,"{'href': 'https://www.reuters.com', 'title': 'Reuters'}"
Much has been learned about long COVID – and much remains to be learned - American Heart Association News,Much has been learned about long COVID – and much remains to be learned  American Heart Association News,"Fri, 24 Feb 2023 08:00:00 GMT",https://news.google.com/rss/articles/CBMibmh0dHBzOi8vd3d3LmhlYXJ0Lm9yZy9lbi9uZXdzLzIwMjMvMDIvMjQvbXVjaC1oYXMtYmVlbi1sZWFybmVkLWFib3V0LWxvbmctY292aWQtYW5kLW11Y2gtcmVtYWlucy10by1iZS1sZWFybmVk0gEA?oc=5&hl=en-US&gl=US&ceid=US:en,"{'href': 'https://www.heart.org', 'title': 'American Heart Association News'}"
Tucker Carlson is More a Symptom of Our Problems than a Cause - Reason,Tucker Carlson is More a Symptom of Our Problems than a Cause  Reason,"Mon, 24 Apr 2023 07:00:00 GMT",https://news.google.com/rss/articles/CBMiY2h0dHBzOi8vcmVhc29uLmNvbS92b2xva2gvMjAyMy8wNC8yNC90dWNrZXItY2FybHNvbi1pcy1tb3JlLWEtc3ltcHRvbS1vZi1vdXItcHJvYmxlbXMtdGhhbi1hLWNhdXNlL9IBAA?oc=5&hl=en-US&gl=US&ceid=US:en,"{'href': 'https://reason.com', 'title': 'Reason'}"
Transcendental Meditation reduces stress-related burnout symptoms among healthcare providers - News-Medical.Net,Transcendental Meditation reduces stress-related burnout symptoms among healthcare providers  News-Medical.Net,"Fri, 03 Mar 2023 08:00:00 GMT",https://news.google.com/rss/articles/CBMijAFodHRwczovL3d3dy5uZXdzLW1lZGljYWwubmV0L25ld3MvMjAyMzAzMDMvVHJhbnNjZW5kZW50YWwtTWVkaXRhdGlvbi1yZWR1Y2VzLXN0cmVzcy1yZWxhdGVkLWJ1cm5vdXQtc3ltcHRvbXMtYW1vbmctaGVhbHRoY2FyZS1wcm92aWRlcnMuYXNweNIBAA?oc=5&hl=en-US&gl=US&ceid=US:en,"{'href': 'https://www.news-medical.net', 'title': 'News-Medical.Net'}"
Some Studies Support Use of Cannabis in Pediatric Cancer; More Research is Needed - Cancer Therapy Advisor,Some Studies Support Use of Cannabis in Pediatric Cancer; More Research is Needed  Cancer Therapy Advisor,"Thu, 31 Aug 2023 07:00:00 GMT",https://news.google.com/rss/articles/CBMie2h0dHBzOi8vd3d3LmNhbmNlcnRoZXJhcHlhZHZpc29yLmNvbS9uZXdzL3NvbWUtc3R1ZGllcy1zdXBwb3J0LXVzZS1vZi1jYW5uYWJpcy1pbi1wZWRpYXRyaWMtY2FuY2VyLW1vcmUtcmVzZWFyY2gtaXMtbmVlZGVkL9IBAA?oc=5&hl=en-US&gl=US&ceid=US:en,"{'href': 'https://www.cancertherapyadvisor.com', 'title': 'Cancer Therapy Advisor'}"
Heatstroke symptoms: Anhidrosis could be a warning sign - what is it? - Express,Heatstroke symptoms: Anhidrosis could be a warning sign - what is it?  Express,"Wed, 21 Jul 2021 07:00:00 GMT",https://news.google.com/rss/articles/CBMid2h0dHBzOi8vd3d3LmV4cHJlc3MuY28udWsvbGlmZS1zdHlsZS9oZWFsdGgvMTQ2NDA1NS9oZWF0c3Ryb2tlLXN5bXB0b21zLXNpZ25zLWFuaGlkcm9zaXMtbGFjay1vZi1zd2VhdC1jYXVzZXMtdHJlYXRtZW500gF7aHR0cHM6Ly93d3cuZXhwcmVzcy5jby51ay9saWZlLXN0eWxlL2hlYWx0aC8xNDY0MDU1L2hlYXRzdHJva2Utc3ltcHRvbXMtc2lnbnMtYW5oaWRyb3Npcy1sYWNrLW9mLXN3ZWF0LWNhdXNlcy10cmVhdG1lbnQvYW1w?oc=5&hl=en-US&gl=US&ceid=US:en,"{'href': 'https://www.express.co.uk', 'title': 'Express'}"
