title,description,published date,url,publisher
How Weight Lifting Helps Me Manage the Negative Symptoms of Schizophrenia - The Mighty,How Weight Lifting Helps Me Manage the Negative Symptoms of Schizophrenia  The Mighty,"Tue, 09 Mar 2021 08:00:00 GMT",https://news.google.com/rss/articles/CBMiXWh0dHBzOi8vdGhlbWlnaHR5LmNvbS90b3BpYy9zY2hpem9waHJlbmlhL21hbmFnZS1zY2hpem9waHJlbmlhLXBzeWNob3Npcy13aXRoLXdlaWdodC1saWZ0aW5nL9IBAA?oc=5&hl=en-US&gl=US&ceid=US:en,"{'href': 'https://themighty.com', 'title': 'The Mighty'}"
Rat-bite fever: Symptoms and treatment - Medical News Today,Rat-bite fever: Symptoms and treatment  Medical News Today,"Fri, 04 Dec 2020 08:00:00 GMT",https://news.google.com/rss/articles/CBMiOGh0dHBzOi8vd3d3Lm1lZGljYWxuZXdzdG9kYXkuY29tL2FydGljbGVzL3JhdC1iaXRlLWZldmVy0gEA?oc=5&hl=en-US&gl=US&ceid=US:en,"{'href': 'https://www.medicalnewstoday.com', 'title': 'Medical News Today'}"
Heart attack symptoms: The warning sign on your earlobe to watch out for - Express,Heart attack symptoms: The warning sign on your earlobe to watch out for  Express,"Wed, 13 May 2020 07:00:00 GMT",https://news.google.com/rss/articles/CBMiaWh0dHBzOi8vd3d3LmV4cHJlc3MuY28udWsvbGlmZS1zdHlsZS9oZWFsdGgvMTI4MTI4Ni9oZWFydC1hdHRhY2stc3ltcHRvbXMtc2lnbnMtY2hlc3QtcGFpbi1lYXJsb2JlLWNyZWFzZdIBbWh0dHBzOi8vd3d3LmV4cHJlc3MuY28udWsvbGlmZS1zdHlsZS9oZWFsdGgvMTI4MTI4Ni9oZWFydC1hdHRhY2stc3ltcHRvbXMtc2lnbnMtY2hlc3QtcGFpbi1lYXJsb2JlLWNyZWFzZS9hbXA?oc=5&hl=en-US&gl=US&ceid=US:en,"{'href': 'https://www.express.co.uk', 'title': 'Express'}"
Study: Epilepsy drug could reverse autism symptoms - NewsNation Now,Study: Epilepsy drug could reverse autism symptoms  NewsNation Now,"Wed, 15 Feb 2023 08:00:00 GMT",https://news.google.com/rss/articles/CBMiV2h0dHBzOi8vd3d3Lm5ld3NuYXRpb25ub3cuY29tL2hlYWx0aC9zdHVkeS1lcGlsZXBzeS1kcnVnLWNvdWxkLXJldmVyc2UtYXV0aXNtLXN5bXB0b21zL9IBW2h0dHBzOi8vd3d3Lm5ld3NuYXRpb25ub3cuY29tL2hlYWx0aC9zdHVkeS1lcGlsZXBzeS1kcnVnLWNvdWxkLXJldmVyc2UtYXV0aXNtLXN5bXB0b21zL2FtcC8?oc=5&hl=en-US&gl=US&ceid=US:en,"{'href': 'https://www.newsnationnow.com', 'title': 'NewsNation Now'}"
Uterine Fibroid Pain Symptom Relief - Everyday Health,Uterine Fibroid Pain Symptom Relief  Everyday Health,"Wed, 25 Jan 2023 08:00:00 GMT",https://news.google.com/rss/articles/CBMiUWh0dHBzOi8vd3d3LmV2ZXJ5ZGF5aGVhbHRoLmNvbS93b21lbnMtaGVhbHRoL2ZyZWUteW91cnNlbGYtZnJvbS1maWJyb2lkLXBhaW4uYXNweNIBAA?oc=5&hl=en-US&gl=US&ceid=US:en,"{'href': 'https://www.everydayhealth.com', 'title': 'Everyday Health'}"
"ADHD gender differences: Signs, diagnosis, and more - Medical News Today","ADHD gender differences: Signs, diagnosis, and more  Medical News Today","Mon, 31 Oct 2022 07:00:00 GMT",https://news.google.com/rss/articles/CBMiUWh0dHBzOi8vd3d3Lm1lZGljYWxuZXdzdG9kYXkuY29tL2FydGljbGVzL2lzLWFkaGQtbW9yZS1jb21tb24taW4tbWFsZXMtb3ItZmVtYWxlc9IBAA?oc=5&hl=en-US&gl=US&ceid=US:en,"{'href': 'https://www.medicalnewstoday.com', 'title': 'Medical News Today'}"
COVID Variant Could Have Surprising Symptom - Videos from The Weather Channel - The Weather Channel,COVID Variant Could Have Surprising Symptom - Videos from The Weather Channel  The Weather Channel,"Thu, 27 Apr 2023 07:00:00 GMT",https://news.google.com/rss/articles/CBMiWmh0dHBzOi8vd2VhdGhlci5jb20vaGVhbHRoL3ZpZGVvL25ldy1jb3ZpZC12YXJpYW50LWNvdWxkLWhhdmUtcG90ZW50aWFsLXN1cnByaXNpbmctc3ltcHRvbdIBAA?oc=5&hl=en-US&gl=US&ceid=US:en,"{'href': 'https://weather.com', 'title': 'The Weather Channel'}"
"In STEMI PCI, Symptom-to-Balloon Time Is What Counts - Medpage Today","In STEMI PCI, Symptom-to-Balloon Time Is What Counts  Medpage Today","Thu, 14 Jan 2021 08:00:00 GMT",https://news.google.com/rss/articles/CBMiMWh0dHBzOi8vd3d3Lm1lZHBhZ2V0b2RheS5jb20vY2FyZGlvbG9neS9wY2kvOTA2OTbSAQA?oc=5&hl=en-US&gl=US&ceid=US:en,"{'href': 'https://www.medpagetoday.com', 'title': 'Medpage Today'}"
How Long Does It Take To Recover From COVID-19 Coronavirus And Return To Work? - Forbes,How Long Does It Take To Recover From COVID-19 Coronavirus And Return To Work?  Forbes,"Tue, 05 May 2020 07:00:00 GMT",https://news.google.com/rss/articles/CBMif2h0dHBzOi8vd3d3LmZvcmJlcy5jb20vc2l0ZXMvYnJ1Y2VsZWUvMjAyMC8wNS8wNS9ob3ctbG9uZy1kb2VzLWl0LXRha2UtdG8tcmVjb3Zlci1mcm9tLWNvdmlkLTE5LWNvcm9uYXZpcnVzLWFuZC1yZXR1cm4tdG8td29yay_SAQA?oc=5&hl=en-US&gl=US&ceid=US:en,"{'href': 'https://www.forbes.com', 'title': 'Forbes'}"
"Multivitamin, mineral supplement linked to less-severe, shorter-lasting illness symptoms - Oregon State University","Multivitamin, mineral supplement linked to less-severe, shorter-lasting illness symptoms  Oregon State University","Tue, 18 Aug 2020 07:00:00 GMT",https://news.google.com/rss/articles/CBMidmh0dHBzOi8vdG9kYXkub3JlZ29uc3RhdGUuZWR1L25ld3MvbXVsdGl2aXRhbWluLW1pbmVyYWwtc3VwcGxlbWVudC1saW5rZWQtbGVzcy1zZXZlcmUtc2hvcnRlci1sYXN0aW5nLWlsbG5lc3Mtc3ltcHRvbXPSAQA?oc=5&hl=en-US&gl=US&ceid=US:en,"{'href': 'https://today.oregonstate.edu', 'title': 'Oregon State University'}"
"High-Functioning Depression: What It Is, Symptoms, Treatment - Shape Magazine","High-Functioning Depression: What It Is, Symptoms, Treatment  Shape Magazine","Thu, 28 Apr 2022 07:00:00 GMT",https://news.google.com/rss/articles/CBMiV2h0dHBzOi8vd3d3LnNoYXBlLmNvbS9saWZlc3R5bGUvbWluZC1hbmQtYm9keS9tZW50YWwtaGVhbHRoL2hpZ2gtZnVuY3Rpb25pbmctZGVwcmVzc2lvbtIBAA?oc=5&hl=en-US&gl=US&ceid=US:en,"{'href': 'https://www.shape.com', 'title': 'Shape Magazine'}"
Cancer: The ‘fleeting’ symptom that requires ‘urgent investigation’ - signs to look for - Express,Cancer: The ‘fleeting’ symptom that requires ‘urgent investigation’ - signs to look for  Express,"Mon, 22 Nov 2021 08:00:00 GMT",https://news.google.com/rss/articles/CBMiY2h0dHBzOi8vd3d3LmV4cHJlc3MuY28udWsvbGlmZS1zdHlsZS9oZWFsdGgvMTUyMDYyOC9jYW5jZXItc3ltcHRvbS10ZXN0aWN1bGFyLWZsZWV0aW5nLXBhaW4tc2Nyb3R1bdIBZ2h0dHBzOi8vd3d3LmV4cHJlc3MuY28udWsvbGlmZS1zdHlsZS9oZWFsdGgvMTUyMDYyOC9jYW5jZXItc3ltcHRvbS10ZXN0aWN1bGFyLWZsZWV0aW5nLXBhaW4tc2Nyb3R1bS9hbXA?oc=5&hl=en-US&gl=US&ceid=US:en,"{'href': 'https://www.express.co.uk', 'title': 'Express'}"
Vitamin D supplementation may help ease depressive symptoms in adults - Medical News Today,Vitamin D supplementation may help ease depressive symptoms in adults  Medical News Today,"Thu, 18 Aug 2022 07:00:00 GMT",https://news.google.com/rss/articles/CBMidGh0dHBzOi8vd3d3Lm1lZGljYWxuZXdzdG9kYXkuY29tL2FydGljbGVzL3ZpdGFtaW4tZC1zdXBwbGVtZW50YXRpb24tc2VlbXMtdG8tYWxsZXZpYXRlLWRlcHJlc3NpdmUtc3ltcHRvbXMtaW4tYWR1bHRz0gEA?oc=5&hl=en-US&gl=US&ceid=US:en,"{'href': 'https://www.medicalnewstoday.com', 'title': 'Medical News Today'}"
New Analyses Find Duopa Improves Parkinson's Symptom Control | 1... - Parkinson's News Today,New Analyses Find Duopa Improves Parkinson's Symptom Control | 1...  Parkinson's News Today,"Fri, 06 Jan 2023 08:00:00 GMT",https://news.google.com/rss/articles/CBMiY2h0dHBzOi8vcGFya2luc29uc25ld3N0b2RheS5jb20vbmV3cy90cmlhbC1hbmFseXNlcy1maW5kLWR1b3BhLWltcHJvdmVzLXBhcmtpbnNvbnMtc3ltcHRvbS1jb250cm9sL9IBAA?oc=5&hl=en-US&gl=US&ceid=US:en,"{'href': 'https://parkinsonsnewstoday.com', 'title': ""Parkinson's News Today""}"
"""That's just part of aging"": Long COVID symptoms are often overlooked in seniors - Salon","""That's just part of aging"": Long COVID symptoms are often overlooked in seniors  Salon","Mon, 30 May 2022 07:00:00 GMT",https://news.google.com/rss/articles/CBMicGh0dHBzOi8vd3d3LnNhbG9uLmNvbS8yMDIyLzA1LzMwL3RoYXRzLWp1c3QtcGFydC1vZi1hZ2luZy1sb25nLXN5bXB0b21zLWFyZS1vZnRlbi1vdmVybG9va2VkLWluLXNlbmlvcnNfcGFydG5lci_SAQA?oc=5&hl=en-US&gl=US&ceid=US:en,"{'href': 'https://www.salon.com', 'title': 'Salon'}"
"'COVID-toes,' tracking dermatological symptoms of COVID-19 - Healio","'COVID-toes,' tracking dermatological symptoms of COVID-19  Healio","Thu, 14 May 2020 07:00:00 GMT",https://news.google.com/rss/articles/CBMihQFodHRwczovL3d3dy5oZWFsaW8uY29tL25ld3MvZGVybWF0b2xvZ3kvMjAyMDA0MjQvZGVybWF0b2xvZ3ktZXhwZXJ0LXdlaWdocy1pbi1vbi1jb3ZpZC10b2VzLXRyYWNraW5nLWRlcm1hdG9sb2dpYy1zeW1wdG9tcy1vZi1jb3ZpZDE50gEA?oc=5&hl=en-US&gl=US&ceid=US:en,"{'href': 'https://www.healio.com', 'title': 'Healio'}"
Ankylosing Spondylitis: Dealing With Fatigue - Everyday Health,Ankylosing Spondylitis: Dealing With Fatigue  Everyday Health,"Tue, 17 Aug 2021 07:00:00 GMT",https://news.google.com/rss/articles/CBMiZmh0dHBzOi8vd3d3LmV2ZXJ5ZGF5aGVhbHRoLmNvbS9hbmt5bG9zaW5nLXNwb25keWxpdGlzL2Fua3lsb3Npbmctc3BvbmR5bGl0aXMtZGVhbGluZy13aXRoLWZhdGlndWUuYXNweNIBAA?oc=5&hl=en-US&gl=US&ceid=US:en,"{'href': 'https://www.everydayhealth.com', 'title': 'Everyday Health'}"
"OCD: Types, Signs & Symptoms - PsyBlog","OCD: Types, Signs & Symptoms  PsyBlog","Mon, 13 Mar 2023 07:00:00 GMT",https://news.google.com/rss/articles/CBMiMmh0dHBzOi8vd3d3LnNwcmluZy5vcmcudWsvMjAyMy8wMy9vY2Qtc3ltcHRvbXMucGhw0gEA?oc=5&hl=en-US&gl=US&ceid=US:en,"{'href': 'https://www.spring.org.uk', 'title': 'PsyBlog'}"
"Key Long COVID Symptoms Persist for Nearly 2 Years, But Many Return to Work - Contagionlive.com","Key Long COVID Symptoms Persist for Nearly 2 Years, But Many Return to Work  Contagionlive.com","Mon, 30 Jan 2023 08:00:00 GMT",https://news.google.com/rss/articles/CBMibWh0dHBzOi8vd3d3LmNvbnRhZ2lvbmxpdmUuY29tL3ZpZXcva2V5LWxvbmctY292aWQtc3ltcHRvbXMtcGVyc2lzdC1mb3ItbmVhcmx5LTIteWVhcnMtYnV0LW1hbnktcmV0dXJuLXRvLXdvcmvSAQA?oc=5&hl=en-US&gl=US&ceid=US:en,"{'href': 'https://www.contagionlive.com', 'title': 'Contagionlive.com'}"
Is Emotional Instability a Core Symptom of ADHD - ADDitude magazine,Is Emotional Instability a Core Symptom of ADHD  ADDitude magazine,"Mon, 10 May 2021 07:00:00 GMT",https://news.google.com/rss/articles/CBMiSWh0dHBzOi8vd3d3LmFkZGl0dWRlbWFnLmNvbS9lbW90aW9uYWwtaW5zdGFiaWxpdHktYS1jb3JlLXN5bXB0b20tb2YtYWRoZC_SAQA?oc=5&hl=en-US&gl=US&ceid=US:en,"{'href': 'https://www.additudemag.com', 'title': 'ADDitude magazine'}"
Can antibiotics treat COVID-19 (coronavirus) plus other treatments - Medical News Today,Can antibiotics treat COVID-19 (coronavirus) plus other treatments  Medical News Today,"Thu, 25 Jun 2020 07:00:00 GMT",https://news.google.com/rss/articles/CBMiV2h0dHBzOi8vd3d3Lm1lZGljYWxuZXdzdG9kYXkuY29tL2FydGljbGVzL2Nhbi1hbnRpYmlvdGljcy10cmVhdC10aGUtY29yb25hdmlydXMtZGlzZWFzZdIBAA?oc=5&hl=en-US&gl=US&ceid=US:en,"{'href': 'https://www.medicalnewstoday.com', 'title': 'Medical News Today'}"
Coronavirus: These two symptoms in your nose can be a sign of COVID-19 - The Times of India,Coronavirus: These two symptoms in your nose can be a sign of COVID-19  The Times of India,"Fri, 09 Oct 2020 07:00:00 GMT",https://news.google.com/rss/articles/CBMipwFodHRwczovL3RpbWVzb2ZpbmRpYS5pbmRpYXRpbWVzLmNvbS9saWZlLXN0eWxlL2hlYWx0aC1maXRuZXNzL2hlYWx0aC1uZXdzL2Nvcm9uYXZpcnVzLXRoZXNlLXR3by1zeW1wdG9tcy1pbi15b3VyLW5vc2UtY2FuLWJlLWEtc2lnbi1vZi1jb3ZpZC0xOS9waG90b3N0b3J5Lzc4NTcyNTAyLmNtc9IBrQFodHRwczovL3RpbWVzb2ZpbmRpYS5pbmRpYXRpbWVzLmNvbS9saWZlLXN0eWxlL2hlYWx0aC1maXRuZXNzL2hlYWx0aC1uZXdzL2Nvcm9uYXZpcnVzLXRoZXNlLXR3by1zeW1wdG9tcy1pbi15b3VyLW5vc2UtY2FuLWJlLWEtc2lnbi1vZi1jb3ZpZC0xOS9hbXBfZXRwaG90b3N0b3J5Lzc4NTcyNTAyLmNtcw?oc=5&hl=en-US&gl=US&ceid=US:en,"{'href': 'https://timesofindia.indiatimes.com', 'title': 'The Times of India'}"
Apr 2022: Opinion: HSC 10-hour wait time symptom of system in distress - Winnipeg Free Press,Apr 2022: Opinion: HSC 10-hour wait time symptom of system in distress  Winnipeg Free Press,"Fri, 01 Apr 2022 07:00:00 GMT",https://news.google.com/rss/articles/CBMibWh0dHBzOi8vd3d3Lndpbm5pcGVnZnJlZXByZXNzLmNvbS9icmVha2luZ25ld3MvMjAyMi8wNC8wMS9oc2MtMTAtaG91ci13YWl0LXRpbWUtc3ltcHRvbS1vZi1zeXN0ZW0taW4tZGlzdHJlc3PSAQA?oc=5&hl=en-US&gl=US&ceid=US:en,"{'href': 'https://www.winnipegfreepress.com', 'title': 'Winnipeg Free Press'}"
The Season of SAD - University of Utah Health Care,The Season of SAD  University of Utah Health Care,"Fri, 04 Nov 2022 07:00:00 GMT",https://news.google.com/rss/articles/CBMiPGh0dHBzOi8vaGVhbHRoY2FyZS51dGFoLmVkdS9oZWFsdGhmZWVkLzIwMjIvMTEvc2Vhc29uLW9mLXNhZNIBAA?oc=5&hl=en-US&gl=US&ceid=US:en,"{'href': 'https://healthcare.utah.edu', 'title': 'University of Utah Health Care'}"
"Long recovery, brain damage, effect of stressors with long COVID - University of Minnesota Twin Cities","Long recovery, brain damage, effect of stressors with long COVID  University of Minnesota Twin Cities","Fri, 11 Nov 2022 08:00:00 GMT",https://news.google.com/rss/articles/CBMiWmh0dHBzOi8vd3d3LmNpZHJhcC51bW4uZWR1L2NvdmlkLTE5L2xvbmctcmVjb3ZlcnktYnJhaW4tZGFtYWdlLWVmZmVjdC1zdHJlc3NvcnMtbG9uZy1jb3ZpZNIBAA?oc=5&hl=en-US&gl=US&ceid=US:en,"{'href': 'https://www.cidrap.umn.edu', 'title': 'University of Minnesota Twin Cities'}"
Can supplements or diet reduce symptoms of arthritis? Here's what the evidence says - The Conversation,Can supplements or diet reduce symptoms of arthritis? Here's what the evidence says  The Conversation,"Mon, 29 Aug 2022 07:00:00 GMT",https://news.google.com/rss/articles/CBMidGh0dHBzOi8vdGhlY29udmVyc2F0aW9uLmNvbS9jYW4tc3VwcGxlbWVudHMtb3ItZGlldC1yZWR1Y2Utc3ltcHRvbXMtb2YtYXJ0aHJpdGlzLWhlcmVzLXdoYXQtdGhlLWV2aWRlbmNlLXNheXMtMTg0MTUx0gEA?oc=5&hl=en-US&gl=US&ceid=US:en,"{'href': 'https://theconversation.com', 'title': 'The Conversation'}"
Grady Diangana sale is merely a symptom of deeper-lying issues at West Ham - The Telegraph,Grady Diangana sale is merely a symptom of deeper-lying issues at West Ham  The Telegraph,"Mon, 07 Sep 2020 07:00:00 GMT",https://news.google.com/rss/articles/CBMib2h0dHBzOi8vd3d3LnRlbGVncmFwaC5jby51ay9mb290YmFsbC8yMDIwLzA5LzA3L3NlbGxpbmctZ3JhZHktZGlhbmdhbmEtbWVyZWx5LXN5bXB0b20tZGVlcGVyLWx5aW5nLWlzc3Vlcy13ZXN0L9IBAA?oc=5&hl=en-US&gl=US&ceid=US:en,"{'href': 'https://www.telegraph.co.uk', 'title': 'The Telegraph'}"
Statins may reduce the risk of Parkinson's-like symptoms in older adults - National Institute on Aging,Statins may reduce the risk of Parkinson's-like symptoms in older adults  National Institute on Aging,"Thu, 14 Jul 2022 07:00:00 GMT",https://news.google.com/rss/articles/CBMiVWh0dHBzOi8vd3d3Lm5pYS5uaWguZ292L25ld3Mvc3RhdGlucy1tYXktcmVkdWNlLXJpc2stcGFya2luc29ucy1zeW1wdG9tcy1vbGRlci1hZHVsdHPSAQA?oc=5&hl=en-US&gl=US&ceid=US:en,"{'href': 'https://www.nia.nih.gov', 'title': 'National Institute on Aging'}"
Bipolar Disorder: Can It Cause Lack of Empathy? - Medical News Today,Bipolar Disorder: Can It Cause Lack of Empathy?  Medical News Today,"Wed, 01 Mar 2023 22:02:43 GMT",https://news.google.com/rss/articles/CBMiRmh0dHBzOi8vd3d3Lm1lZGljYWxuZXdzdG9kYXkuY29tL2FydGljbGVzL2JpcG9sYXItZGlzb3JkZXItYW5kLWVtcGF0aHnSAQA?oc=5&hl=en-US&gl=US&ceid=US:en,"{'href': 'https://www.medicalnewstoday.com', 'title': 'Medical News Today'}"
Do I Have COVID-19 or the Flu? - University of Utah Health Care,Do I Have COVID-19 or the Flu?  University of Utah Health Care,"Wed, 08 Jul 2020 07:00:00 GMT",https://news.google.com/rss/articles/CBMiZGh0dHBzOi8vaGVhbHRoY2FyZS51dGFoLmVkdS9oZWFsdGhmZWVkLzIwMjAvMDcvc2ltaWxhcml0aWVzLWFuZC1kaWZmZXJlbmNlcy1iZXR3ZWVuLWZsdS1hbmQtY292aWQtMTnSAQA?oc=5&hl=en-US&gl=US&ceid=US:en,"{'href': 'https://healthcare.utah.edu', 'title': 'University of Utah Health Care'}"
18 Symptoms That Could Indicate Adult ADHD - Health Essentials,18 Symptoms That Could Indicate Adult ADHD  Health Essentials,"Wed, 19 Oct 2022 07:00:00 GMT",https://news.google.com/rss/articles/CBMiOmh0dHBzOi8vaGVhbHRoLmNsZXZlbGFuZGNsaW5pYy5vcmcvYWRoZC1zeW1wdG9tcy1pbi1hZHVsdHPSAQA?oc=5&hl=en-US&gl=US&ceid=US:en,"{'href': 'https://health.clevelandclinic.org', 'title': 'Health Essentials'}"
Lateral flow tests are 95% effective at detecting Covid-19 when used at the onset of symptoms - University of Oxford,Lateral flow tests are 95% effective at detecting Covid-19 when used at the onset of symptoms  University of Oxford,"Wed, 14 Jul 2021 07:00:00 GMT",https://news.google.com/rss/articles/CBMidGh0dHBzOi8vd3d3Lm94LmFjLnVrL25ld3MvMjAyMS0wNy0xNC1sYXRlcmFsLWZsb3ctdGVzdHMtYXJlLTk1LWVmZmVjdGl2ZS1kZXRlY3RpbmctY292aWQtMTktd2hlbi11c2VkLW9uc2V0LXN5bXB0b21z0gEA?oc=5&hl=en-US&gl=US&ceid=US:en,"{'href': 'https://www.ox.ac.uk', 'title': 'University of Oxford'}"
"Dr. Roach: Long COVID refers to symptoms, not transmission of virus - Detroit News","Dr. Roach: Long COVID refers to symptoms, not transmission of virus  Detroit News","Tue, 12 Oct 2021 07:00:00 GMT",https://news.google.com/rss/articles/CBMidmh0dHBzOi8vd3d3LmRldHJvaXRuZXdzLmNvbS9zdG9yeS9saWZlL2FkdmljZS8yMDIxLzEwLzEyL2tlaXRoLXJvYWNoLWxvbmctY292aWQtc3ltcHRvbXMtdHJhbnNtaXNzaW9uLXZpcnVzLzExOTA0MDc4Ni_SAQA?oc=5&hl=en-US&gl=US&ceid=US:en,"{'href': 'https://www.detroitnews.com', 'title': 'Detroit News'}"
Nine signs of cancer including ‘silent’ symptom you can spot on your feet - The Mirror,Nine signs of cancer including ‘silent’ symptom you can spot on your feet  The Mirror,"Tue, 29 Aug 2023 07:00:00 GMT",https://news.google.com/rss/articles/CBMiUGh0dHBzOi8vd3d3Lm1pcnJvci5jby51ay9uZXdzL2hlYWx0aC9uaW5lLXNpZ25zLWNhbmNlci1pbmNsdWRpbmctc2lsZW50LTMwNzk0MjAx0gFUaHR0cHM6Ly93d3cubWlycm9yLmNvLnVrL25ld3MvaGVhbHRoL25pbmUtc2lnbnMtY2FuY2VyLWluY2x1ZGluZy1zaWxlbnQtMzA3OTQyMDEuYW1w?oc=5&hl=en-US&gl=US&ceid=US:en,"{'href': 'https://www.mirror.co.uk', 'title': 'The Mirror'}"
10 Medical Conditions Linked to Depression - Mental Illness - Health.com,10 Medical Conditions Linked to Depression - Mental Illness  Health.com,"Sun, 25 Sep 2022 07:00:00 GMT",https://news.google.com/rss/articles/CBMiS2h0dHBzOi8vd3d3LmhlYWx0aC5jb20vY29uZGl0aW9uL2RlcHJlc3Npb24vY29uZGl0aW9ucy1saW5rZWQtdG8tZGVwcmVzc2lvbtIBAA?oc=5&hl=en-US&gl=US&ceid=US:en,"{'href': 'https://www.health.com', 'title': 'Health.com'}"
Maria Menounos Says 1st Pancreatic Cancer Symptoms Were Dismissed by Doctors - TODAY,Maria Menounos Says 1st Pancreatic Cancer Symptoms Were Dismissed by Doctors  TODAY,"Thu, 04 May 2023 07:00:00 GMT",https://news.google.com/rss/articles/CBMiVGh0dHBzOi8vd3d3LnRvZGF5LmNvbS9oZWFsdGgvbWFyaWEtbWVub3Vub3MtMXN0LXBhbmNyZWF0aWMtY2FuY2VyLXN5bXB0b21zLXJjbmE4MjYyNdIBKWh0dHBzOi8vd3d3LnRvZGF5LmNvbS90b2RheS9hbXAvcmNuYTgyNjI1?oc=5&hl=en-US&gl=US&ceid=US:en,"{'href': 'https://www.today.com', 'title': 'TODAY'}"
Still Have Symptoms on Your Gluten-Free Diet? - Verywell Health,Still Have Symptoms on Your Gluten-Free Diet?  Verywell Health,"Tue, 20 Oct 2020 07:00:00 GMT",https://news.google.com/rss/articles/CBMiRmh0dHBzOi8vd3d3LnZlcnl3ZWxsaGVhbHRoLmNvbS9zeW1wdG9tcy13aGVuLWVhdGluZy1nbHV0ZW4tZnJlZS01NjIzMznSAQA?oc=5&hl=en-US&gl=US&ceid=US:en,"{'href': 'https://www.verywellhealth.com', 'title': 'Verywell Health'}"
Longitudinal analysis of humoral immunity against SARS-CoV-2 Spike in convalescent individuals up to 8 months post ... - ScienceDirect.com,Longitudinal analysis of humoral immunity against SARS-CoV-2 Spike in convalescent individuals up to 8 months post ...  ScienceDirect.com,"Tue, 20 Apr 2021 07:00:00 GMT",https://news.google.com/rss/articles/CBMiQ2h0dHBzOi8vd3d3LnNjaWVuY2VkaXJlY3QuY29tL3NjaWVuY2UvYXJ0aWNsZS9waWkvUzI2NjYzNzkxMjEwMDExOFjSAQA?oc=5&hl=en-US&gl=US&ceid=US:en,"{'href': 'https://www.sciencedirect.com', 'title': 'ScienceDirect.com'}"
"Why You Cough After Exercising, Especially Running - Men's Health","Why You Cough After Exercising, Especially Running  Men's Health","Wed, 08 Jul 2020 07:00:00 GMT",https://news.google.com/rss/articles/CBMiUWh0dHBzOi8vd3d3Lm1lbnNoZWFsdGguY29tL2hlYWx0aC9hMTk1MzQyMjcvZXhlcmNpc2UtaW5kdWNlZC1hc3RobWEtYW5kLWNvdWdoaW5nL9IBAA?oc=5&hl=en-US&gl=US&ceid=US:en,"{'href': 'https://www.menshealth.com', 'title': ""Men's Health""}"
Vitamin B12 deficiency symptoms: The sign in your chest you could be lacking B12 - Express,Vitamin B12 deficiency symptoms: The sign in your chest you could be lacking B12  Express,"Fri, 12 Jun 2020 07:00:00 GMT",https://news.google.com/rss/articles/CBMiZ2h0dHBzOi8vd3d3LmV4cHJlc3MuY28udWsvbGlmZS1zdHlsZS9oZWFsdGgvMTI5NDg5MS92aXRhbWluLWIxMi1kZWZpY2llbmN5LXN5bXB0b21zLWlycmVndWxhci1oZWFydGJlYXTSAWtodHRwczovL3d3dy5leHByZXNzLmNvLnVrL2xpZmUtc3R5bGUvaGVhbHRoLzEyOTQ4OTEvdml0YW1pbi1iMTItZGVmaWNpZW5jeS1zeW1wdG9tcy1pcnJlZ3VsYXItaGVhcnRiZWF0L2FtcA?oc=5&hl=en-US&gl=US&ceid=US:en,"{'href': 'https://www.express.co.uk', 'title': 'Express'}"
"Vaccines may not prevent many symptoms of long covid, study suggests - The Washington Post","Vaccines may not prevent many symptoms of long covid, study suggests  The Washington Post","Wed, 25 May 2022 07:00:00 GMT",https://news.google.com/rss/articles/CBMiV2h0dHBzOi8vd3d3Lndhc2hpbmd0b25wb3N0LmNvbS9oZWFsdGgvMjAyMi8wNS8yNS9sb25nLWNvdmlkLXZhY2NpbmVzLXNsaWdodC1wcm90ZWN0aW9uL9IBAA?oc=5&hl=en-US&gl=US&ceid=US:en,"{'href': 'https://www.washingtonpost.com', 'title': 'The Washington Post'}"
13-Year-Old Boy Dies After Experiencing COVID-19 Symptoms - PEOPLE,13-Year-Old Boy Dies After Experiencing COVID-19 Symptoms  PEOPLE,"Mon, 20 Jul 2020 07:00:00 GMT",https://news.google.com/rss/articles/CBMiaGh0dHBzOi8vcGVvcGxlLmNvbS9oZWFsdGgvMTMteWVhci1vbGQtY2FsaWZvcm5pYS1ib3ktc3VkZGVubHktZGllcy1hZnRlci1leHBlcmllbmNpbmctY292aWQtMTktc3ltcHRvbXMv0gEA?oc=5&hl=en-US&gl=US&ceid=US:en,"{'href': 'https://people.com', 'title': 'PEOPLE'}"
"Higher Risk of Stomach Issues with Omicron, BA.2? Decoding COVID & Gut Link - The Quint FIT","Higher Risk of Stomach Issues with Omicron, BA.2? Decoding COVID & Gut Link  The Quint FIT","Tue, 05 Apr 2022 07:00:00 GMT",https://news.google.com/rss/articles/CBMiRmh0dHBzOi8vd3d3LnRoZXF1aW50LmNvbS9maXQvY292aWQtYW5kLWd1dC1oZWFsdGgtc3ltcHRvbXMtb21pY3Jvbi1iYTLSAVBodHRwczovL3d3dy50aGVxdWludC5jb20vYW1wL3N0b3J5L2ZpdC9jb3ZpZC1hbmQtZ3V0LWhlYWx0aC1zeW1wdG9tcy1vbWljcm9uLWJhMg?oc=5&hl=en-US&gl=US&ceid=US:en,"{'href': 'https://www.thequint.com', 'title': 'The Quint FIT'}"
"New Model May Explain Variability in Parkinson's Symptoms, Progression - Parkinson's News Today","New Model May Explain Variability in Parkinson's Symptoms, Progression  Parkinson's News Today","Fri, 30 Apr 2021 07:00:00 GMT",https://news.google.com/rss/articles/CBMiYmh0dHBzOi8vcGFya2luc29uc25ld3N0b2RheS5jb20vbmV3cy9zb2MtbW9kZWwtaGVscC1leHBsYWluLXZhcmlhYmxlLWRpc2Vhc2Utc3ltcHRvbXMtcHJvZ3Jlc3Npb24v0gEA?oc=5&hl=en-US&gl=US&ceid=US:en,"{'href': 'https://parkinsonsnewstoday.com', 'title': ""Parkinson's News Today""}"
"Boy, 4, gets horror diagnosis after 'sore body' symptom following chicken pox - The Mirror","Boy, 4, gets horror diagnosis after 'sore body' symptom following chicken pox  The Mirror","Tue, 02 May 2023 07:00:00 GMT",https://news.google.com/rss/articles/CBMiU2h0dHBzOi8vd3d3Lm1pcnJvci5jby51ay9uZXdzL3VrLW5ld3MvZmFtaWx5cy1ob3Jyb3ItYWZ0ZXItYm95cy1wZXJzaXN0aW5nLTI5ODY2NDUy0gFXaHR0cHM6Ly93d3cubWlycm9yLmNvLnVrL25ld3MvdWstbmV3cy9mYW1pbHlzLWhvcnJvci1hZnRlci1ib3lzLXBlcnNpc3RpbmctMjk4NjY0NTIuYW1w?oc=5&hl=en-US&gl=US&ceid=US:en,"{'href': 'https://www.mirror.co.uk', 'title': 'The Mirror'}"
Do you want to know if you have COVID-19 symptoms? - Newsbook,Do you want to know if you have COVID-19 symptoms?  Newsbook,"Thu, 30 Apr 2020 07:00:00 GMT",https://news.google.com/rss/articles/CBMiTWh0dHBzOi8vbmV3c2Jvb2suY29tLm10L2VuL2RvLXlvdS13YW50LXRvLWtub3ctaWYteW91LWhhdmUtY292aWQtMTktc3ltcHRvbXMv0gEA?oc=5&hl=en-US&gl=US&ceid=US:en,"{'href': 'https://newsbook.com.mt', 'title': 'Newsbook'}"
NYSDOL Issues Guidance Regarding Employee Use of Cannabis - Mintz,NYSDOL Issues Guidance Regarding Employee Use of Cannabis  Mintz,"Wed, 03 Nov 2021 07:00:00 GMT",https://news.google.com/rss/articles/CBMid2h0dHBzOi8vd3d3Lm1pbnR6LmNvbS9pbnNpZ2h0cy1jZW50ZXIvdmlld3BvaW50cy8yMjI2LzIwMjEtMTEtMDMtbnlzZG9sLWlzc3Vlcy1ndWlkYW5jZS1yZWdhcmRpbmctZW1wbG95ZWUtdXNlLWNhbm5hYmlz0gEA?oc=5&hl=en-US&gl=US&ceid=US:en,"{'href': 'https://www.mintz.com', 'title': 'Mintz'}"
Depression (major depressive disorder) - Symptoms and causes - Mayo Clinic,Depression (major depressive disorder) - Symptoms and causes  Mayo Clinic,"Fri, 14 Oct 2022 07:00:00 GMT",https://news.google.com/rss/articles/CBMiVmh0dHBzOi8vd3d3Lm1heW9jbGluaWMub3JnL2Rpc2Vhc2VzLWNvbmRpdGlvbnMvZGVwcmVzc2lvbi9zeW1wdG9tcy1jYXVzZXMvc3ljLTIwMzU2MDA30gEA?oc=5&hl=en-US&gl=US&ceid=US:en,"{'href': 'https://www.mayoclinic.org', 'title': 'Mayo Clinic'}"
'How I knew I had lung cancer': Three survivors share their symptoms - MD Anderson Cancer Center,'How I knew I had lung cancer': Three survivors share their symptoms  MD Anderson Cancer Center,"Tue, 18 Oct 2022 07:00:00 GMT",https://news.google.com/rss/articles/CBMifWh0dHBzOi8vd3d3Lm1kYW5kZXJzb24ub3JnL2NhbmNlcndpc2UvLWhvdy1pLWtuZXctaS1oYWQtbHVuZy1jYW5jZXItLS10aHJlZS1zdXJ2aXZvcnMtc2hhcmUtdGhlaXItc3ltcHRvbXMuaDAwLTE1OTU0MzY5MC5odG1s0gEA?oc=5&hl=en-US&gl=US&ceid=US:en,"{'href': 'https://www.mdanderson.org', 'title': 'MD Anderson Cancer Center'}"
Temperature Sensitivity in Fibromyalgia and ME/CFS - Verywell Health,Temperature Sensitivity in Fibromyalgia and ME/CFS  Verywell Health,"Thu, 18 May 2023 07:00:00 GMT",https://news.google.com/rss/articles/CBMiV2h0dHBzOi8vd3d3LnZlcnl3ZWxsaGVhbHRoLmNvbS90ZW1wZXJhdHVyZS1zZW5zaXRpdml0eS1pbi1maWJyb215YWxnaWEtYW5kLW1lY2ZzLTcxNjAyNdIBAA?oc=5&hl=en-US&gl=US&ceid=US:en,"{'href': 'https://www.verywellhealth.com', 'title': 'Verywell Health'}"
"Scripps, UCSD focus on 'long haul' COVID-19 symptoms - The San Diego Union-Tribune","Scripps, UCSD focus on 'long haul' COVID-19 symptoms  The San Diego Union-Tribune","Sat, 03 Apr 2021 07:00:00 GMT",https://news.google.com/rss/articles/CBMigQFodHRwczovL3d3dy5zYW5kaWVnb3VuaW9udHJpYnVuZS5jb20vbmV3cy9oZWFsdGgvc3RvcnkvMjAyMS0wNC0wMy9zY3JpcHBzLWpvaW5zLXVjc2QtaW4tZ3Jvd2luZy1mb2N1cy1vbi1sb25nLWhhdWwtY292aWQtc3ltcHRvbXPSAQA?oc=5&hl=en-US&gl=US&ceid=US:en,"{'href': 'https://www.sandiegouniontribune.com', 'title': 'The San Diego Union-Tribune'}"
World Perimenopause Day: Symptoms can begin long before your periods stop – and it's impacting women's mental ... - The Independent,World Perimenopause Day: Symptoms can begin long before your periods stop – and it's impacting women's mental ...  The Independent,"Mon, 11 Oct 2021 07:00:00 GMT",https://news.google.com/rss/articles/CBMiZWh0dHBzOi8vd3d3LmluZGVwZW5kZW50LmNvLnVrL2xpZmUtc3R5bGUvaGVhbHRoLWFuZC1mYW1pbGllcy9zeW1wdG9tcy1tZW5vcGF1c2UtaHJ0LWdwcy1iMTkzNTkxOS5odG1s0gEA?oc=5&hl=en-US&gl=US&ceid=US:en,"{'href': 'https://www.independent.co.uk', 'title': 'The Independent'}"
